average_rating,cast_1,cast_2,cast_3,cast_4,cast_5,country,director,genres,language,letterboxd_uri,poster_url,runtime,studio,synopsis,title,watched_by,year
3.84,Scott Adsit (Baymax (voice)),Ryan Potter (Hiro Hamada (voice)),Daniel Henney (Tadashi Hamada (voice)),T.J. Miller (Fred (voice)),Jamie Chung (GoGo Tomago (voice)),USA,"Don Hall, Chris Williams","Science Fiction, Comedy, Action, Family, Animation, Adventure",English,https://boxd.it/5rje,https://a.ltrbxd.com/resized/sm/upload/wc/nn/r0/8o/big-hero-6-1200-1200-675-675-crop-000000.jpg?v=096e577416,102,Walt Disney Animation Studios,"A special bond develops between plus-sized inflatable robot Baymax, and prodigy Hiro Hamada, who team up with a group of friends to form a band of high-tech heroes.",Big Hero 6,"Reid, Zach",2014
2.93,Scarlett Johansson (Natasha Romanoff / Black Widow),Florence Pugh (Yelena Belova),Rachel Weisz (Melina),David Harbour (Alexei),Ray Winstone (Dreykov),USA,Cate Shortland,"Action, Adventure, Science Fiction",English,https://boxd.it/hWV8,https://a.ltrbxd.com/resized/sm/upload/1i/dt/e0/63/black-widow-2021-1200-1200-675-675-crop-000000.jpg?v=47e1e4eff3,134,Marvel Studios,"Natasha Romanoff, also known as Black Widow, confronts the darker parts of her ledger when a dangerous conspiracy with ties to her past arises. Pursued by a force that will stop at nothing to bring her down, Natasha must deal with her history as a spy and the broken relationships left in her wake long before she became an Avenger.",Black Widow,"Reid, Zach",2021
3.22,Tobey Maguire (Spider-Man / Peter Parker),Kirsten Dunst (Mary Jane Watson),James Franco (New Goblin / Harry Osborn),Thomas Haden Church (Sandman / Flint Marko),Topher Grace (Venom / Eddie Brock),USA,Sam Raimi,"Science Fiction, Action, Adventure",English,https://boxd.it/2a7Y,https://a.ltrbxd.com/resized/sm/upload/8l/e8/c8/6l/spider-man-3-1200-1200-675-675-crop-000000.jpg?v=8c1980ede4,139,"Laura Ziskin Productions, Marvel Studios, Columbia Pictures","The seemingly invincible Spider-Man goes up against an all-new crop of villains—including the shape-shifting Sandman. While Spider-Man’s superpowers are altered by an alien organism, his alter ego, Peter Parker, deals with nemesis Eddie Brock and also gets caught up in a love triangle.",Spider-Man 3,"Reid, Zach",2007
4.02,Tom Hanks (Woody (voice)),Tim Allen (Buzz Lightyear (voice)),Joan Cusack (Jessie (voice)),Don Rickles (Mr. Potato Head (voice)),Wallace Shawn (Rex (voice)),USA,Lee Unkrich,"Comedy, Family, Animation",English,https://boxd.it/1WRe,https://a.ltrbxd.com/resized/sm/upload/ou/bu/8l/cf/toy-story-3-40-1200-1200-675-675-crop-000000.jpg?v=fb3bc382b9,102,Pixar,"Woody, Buzz, and the rest of Andy's toys haven't been played with in years. With Andy about to go to college, the gang find themselves accidentally left at a nefarious day care center. The toys must band together to escape and return home to Andy.",Toy Story 3,"Reid, Zach",2010
2.33,Chris Hemsworth (Thor),Natalie Portman (Jane Foster / The Mighty Thor),Christian Bale (Gorr),Tessa Thompson (King Valkyrie),Taika Waititi (Korg / Old Kronan God (voice)),USA,Taika Waititi,"Action, Fantasy, Comedy",English,https://boxd.it/mMAY,https://a.ltrbxd.com/resized/sm/upload/if/fa/6g/az/thor-1200-1200-675-675-crop-000000.jpg?v=7a8bd83a71,119,"Marvel Studios, Kevin Feige Productions","After his retirement is interrupted by Gorr the God Butcher, a galactic killer who seeks the extinction of the gods, Thor Odinson enlists the help of King Valkyrie, Korg, and ex-girlfriend Jane Foster, who now wields Mjolnir as the Mighty Thor. Together they embark upon a harrowing cosmic adventure to uncover the mystery of the God Butcher’s vengeance and stop him before it’s too late.",Thor: Love and Thunder,"Reid, Zach",2022
3.01,Robert Downey Jr. (Tony Stark),Gwyneth Paltrow (Pepper Potts),Don Cheadle (Lt. Col. James 'Rhodey' Rhodes),Scarlett Johansson (Natalie Rushman / Natasha Romanoff),Sam Rockwell (Justin Hammer),USA,Jon Favreau,"Adventure, Science Fiction, Action",English,https://boxd.it/1WZM,https://a.ltrbxd.com/resized/sm/upload/tg/cj/3a/jg/iron-man-2-50-1200-1200-675-675-crop-000000.jpg?v=879e105133,124,"Marvel Studios, Fairview Entertainment, Marvel Entertainment","With the world now aware of his dual life as the armored superhero Iron Man, billionaire inventor Tony Stark faces pressure from the government, the press and the public to share his technology with the military. Unwilling to let go of his invention, Stark, with Pepper Potts and James 'Rhodey' Rhodes at his side, must forge new alliances – and confront powerful enemies.",Iron Man 2,"Reid, Zach",2010
3.48,Jennifer Lawrence (Katniss Everdeen),Josh Hutcherson (Peeta Mellark),Liam Hemsworth (Gale Hawthorne),Woody Harrelson (Haymitch Abernathy),Elizabeth Banks (Effie Trinket),Germany,Francis Lawrence,"Adventure, Action, Science Fiction",English,https://boxd.it/4hk0,https://a.ltrbxd.com/resized/sm/upload/nt/h0/tn/ff/the-hunger-games-mockingjay-part-2-1200-1200-675-675-crop-000000.jpg?v=2644c829fe,137,"Lionsgate, Color Force, Studio Babelsberg","As the war between the Capitol and the districts reaches its peak, Katniss Everdeen embarks on a perilous mission to liberate Panem and confront President Snow. Joined by a team of trusted allies, she navigates deadly traps, shifting loyalties, and the heavy cost of rebellion, determined to bring freedom to her people and end the Hunger Games once and for all.",The Hunger Games: Mockingjay – Part 2,"Reid, Zach",2015
4.12,Hugh Jackman (Logan / X-24),Dafne Keen (Laura),Patrick Stewart (Charles),Elizabeth Rodriguez (Gabriela),Boyd Holbrook (Pierce),USA,James Mangold,"Drama, Science Fiction, Action",English,https://boxd.it/7Piy,https://a.ltrbxd.com/resized/sm/upload/3g/vl/z4/dt/logan-2017-1200-1200-675-675-crop-000000.jpg?v=33cba47db1,137,"Hutch Parker Entertainment, The Donners' Company, Genre Films, 20th Century Fox, Marvel Entertainment, TSG Entertainment","In the near future, a weary Logan cares for an ailing Professor X in a hideout on the Mexican border. But Logan's attempts to hide from the world and his legacy are upended when a young mutant arrives, pursued by dark forces.",Logan,"Reid, Zach",2017
3.21,Paul Rudd (Scott Lang / Ant-Man),Michael Douglas (Dr. Hank Pym),Evangeline Lilly (Hope van Dyne),Corey Stoll (Darren Cross / Yellowjacket),Bobby Cannavale (Paxton),USA,Peyton Reed,"Adventure, Science Fiction, Action",English,https://boxd.it/3vmW,https://a.ltrbxd.com/resized/sm/upload/6n/ne/n7/vu/ant-man-1200-1200-675-675-crop-000000.jpg?v=414d604c13,117,Marvel Studios,"Armed with the astonishing ability to shrink in scale but increase in strength, master thief Scott Lang must embrace his inner-hero and help his mentor, Doctor Hank Pym, protect the secret behind his spectacular Ant-Man suit from a new generation of towering threats. Against seemingly insurmountable obstacles, Pym and Lang must plan and pull off a heist that will save the world.",Ant-Man,"Reid, Zach",2015
2.62,Brie Larson (Carol Danvers / Vers / Captain Marvel),Samuel L. Jackson (Nick Fury),Ben Mendelsohn (Talos / Keller),Jude Law (Yon-Rogg),Annette Bening (Supreme Intelligence / Dr. Wendy Lawson),USA,"Ryan Fleck, Anna Boden","Science Fiction, Action, Adventure",English,https://boxd.it/9vSA,https://a.ltrbxd.com/resized/sm/upload/t6/3d/p9/22/captain-marvel-1200-1200-675-675-crop-000000.jpg?v=c93f53fe2c,124,Marvel Studios,"The story follows Carol Danvers as she becomes one of the universe’s most powerful heroes when Earth is caught in the middle of a galactic war between two alien races. Set in the 1990s, Captain Marvel is an all-new adventure from a previously unseen period in the history of the Marvel Cinematic Universe.",Captain Marvel,"Reid, Zach",2019
3.10,Robert Downey Jr. (Tony Stark),Gwyneth Paltrow (Pepper Potts),Don Cheadle (Colonel James Rhodes),Guy Pearce (Aldrich Killian),Rebecca Hall (Maya Hansen),USA,Shane Black,"Action, Adventure, Science Fiction",English,https://boxd.it/2cBQ,https://a.ltrbxd.com/resized/sm/upload/2r/k1/nj/pv/iron-man-3-1200-1200-675-675-crop-000000.jpg?v=d56c523b1f,130,Marvel Studios,"When Tony Stark's world is torn apart by a formidable terrorist called the Mandarin, he starts an odyssey of rebuilding and retribution.",Iron Man 3,"Reid, Zach",2013
2.85,Chris Hemsworth (Thor),Natalie Portman (Jane Foster),Tom Hiddleston (Loki),Anthony Hopkins (Odin),Stellan Skarsgård (Erik Selvig),USA,Kenneth Branagh,"Action, Adventure, Fantasy",English,https://boxd.it/1WQU,https://a.ltrbxd.com/resized/sm/upload/o8/mt/91/41/thor-20-1200-1200-675-675-crop-000000.jpg?v=4d6fafd09b,115,"Marvel Studios, Marvel Entertainment","Against his father Odin's will, The Mighty Thor - a powerful but arrogant warrior god - recklessly reignites an ancient war. Thor is cast down to Earth and forced to live among humans as punishment. Once here, Thor learns what it takes to be a true hero when the most dangerous villain of his world sends the darkest forces of Asgard to invade Earth.",Thor,"Reid, Zach",2011
3.92,Tom Hanks (Woody (voice)),Tim Allen (Buzz Lightyear (voice)),Joan Cusack (Jessie (voice)),Kelsey Grammer (Prospector (voice)),Don Rickles (Mr. Potato Head (voice)),USA,John Lasseter,"Comedy, Family, Animation",English,https://boxd.it/29qq,https://a.ltrbxd.com/resized/sm/upload/jn/7h/ol/bx/toy-story-2-1200-1200-675-675-crop-000000.jpg?v=b2895e172e,92,Pixar,"Andy heads off to Cowboy Camp, leaving his toys to their own devices. Things shift into high gear when an obsessive toy collector named Al McWhiggen, owner of Al's Toy Barn kidnaps Woody. Andy's toys mount a daring rescue mission, Buzz Lightyear meets his match and Woody has to decide where he and his heart truly belong.",Toy Story 2,"Reid, Zach",1999
3.40,Simu Liu (Shaun / Shang-Chi),Tony Leung Chiu-wai (Xu Wenwu),Awkwafina (Katy),Ben Kingsley (Trevor Slattery),Zhang Meng'er (Xialing),USA,Destin Daniel Cretton,"Adventure, Fantasy, Action",English,https://boxd.it/kLDI,https://a.ltrbxd.com/resized/sm/upload/g3/ha/ra/bu/shang-chi-1200-1200-675-675-crop-000000.jpg?v=813ec0e7aa,132,Marvel Studios,Shang-Chi must confront the past he thought he left behind when he is drawn into the web of the mysterious Ten Rings organization.,Shang-Chi and the Legend of the Ten Rings,"Reid, Zach",2021
3.76,Taron Egerton (Gary 'Eggsy' Unwin),Colin Firth (Harry Hart / Galahad),Samuel L. Jackson (Valentine),Mark Strong (Merlin),Sophie Cookson (Roxy),UK,Matthew Vaughn,"Action, Comedy, Crime, Adventure",English,https://boxd.it/6dxe,https://a.ltrbxd.com/resized/sm/upload/hq/ob/tz/ns/uRHdkM871YJQDl3ux3ulCQw7BfV-1200-1200-675-675-crop-000000.jpg?v=8ab7014b42,129,"20th Century Fox, Marv, Cloudy Productions, TSG Entertainment",The story of a super-secret spy organization that recruits an unrefined but promising street kid into the agency's ultra-competitive training program just as a global threat emerges from a twisted tech genius.,Kingsman: The Secret Service,"Reid, Zach",2014
3.43,Craig T. Nelson (Bob Parr / Mr. Incredible (voice)),Holly Hunter (Helen Parr / Elastigirl (voice)),Sarah Vowell (Violet Parr (voice)),Huck Milner (Dashiell 'Dash' Parr (voice)),Catherine Keener (Evelyn Deavor (voice)),USA,Brad Bird,"Family, Action, Animation, Adventure",English,https://boxd.it/7IPg,https://a.ltrbxd.com/resized/sm/upload/u6/w5/rp/m6/incredibles-2-1200-1200-675-675-crop-000000.jpg?v=9022dfad06,118,Pixar,"Elastigirl springs into action to save the day, while Mr. Incredible faces his greatest challenge yet – taking care of the problems of his three children.",Incredibles 2,"Reid, Zach",2018
3.28,Letitia Wright (Shuri),Tenoch Huerta Mejía (Namor),Lupita Nyong'o (Nakia),Danai Gurira (Okoye),Winston Duke (M'Baku),USA,Ryan Coogler,"Science Fiction, Adventure, Action",English,https://boxd.it/igPu,https://a.ltrbxd.com/resized/sm/upload/3j/c8/w0/ot/black-1200-1200-675-675-crop-000000.jpg?v=56479a660b,162,Marvel Studios,"Queen Ramonda, Shuri, M’Baku, Okoye and the Dora Milaje fight to protect their nation from intervening world powers in the wake of King T’Challa’s death. As the Wakandans strive to embrace their next chapter, the heroes must band together with the help of War Dog Nakia and Everett Ross and forge a new path for the kingdom of Wakanda.",Black Panther: Wakanda Forever,"Reid, Zach",2022
3.85,Chris Pratt (Emmet Brickowski (voice)),Elizabeth Banks (Wyldstyle / Lucy (voice)),Will Ferrell (Lord Business / President Business / The Man Upstairs),Morgan Freeman (Vitruvius (voice)),Will Arnett (Batman / Bruce Wayne (voice)),USA,"Phil Lord, Christopher Miller","Family, Fantasy, Comedy, Animation, Adventure",English,https://boxd.it/4pDO,https://a.ltrbxd.com/resized/alternative-backdrop/1/0/5/1/8/8/tmdb/d4zaHEoI1yrpeQxBkulo8H9FEQP-1200-1200-675-675-crop-000000.jpg?v=500c7e755c,100,"Lin Pictures, Vertigo Entertainment, Village Roadshow Pictures, LEGO, Animal Logic, Warner Animation Group, RatPac Entertainment","An ordinary Lego mini-figure, mistakenly thought to be the extraordinary MasterBuilder, is recruited to join a quest to stop an evil Lego tyrant from conquering the universe.",The Lego Movie,"Reid, Zach",2014
3.45,Jesse Eisenberg (J. Daniel Atlas),Woody Harrelson (Merritt McKinney),Isla Fisher (Henley Reeves),Dave Franco (Jack Wilder),Mark Ruffalo (Dylan Rhodes),USA,Louis Leterrier,"Thriller, Crime",English,https://boxd.it/2Bsu,https://a.ltrbxd.com/resized/sm/upload/1e/fs/rb/zd/now-you-see-me-1200-1200-675-675-crop-000000.jpg?v=01bf194003,116,"Summit Entertainment, K/O Paper Products, SOIXAN7E QUIN5E, See Me Louisiana",An FBI agent and an Interpol detective track a team of illusionists who pull off bank heists during their performances and reward their audiences with the money.,Now You See Me,"Reid, Zach",2013
3.63,Jonah Hill (Schmidt),Channing Tatum (Jenko),Brie Larson (Molly Tracey),Dave Franco (Eric Molson),Rob Riggle (Mr. Walters),USA,"Phil Lord, Christopher Miller","Crime, Action, Comedy",English,https://boxd.it/J0,https://a.ltrbxd.com/resized/sm/upload/ok/d4/o0/dt/21-jump-street-1200-1200-675-675-crop-000000.jpg?v=e7921fa224,109,"Columbia Pictures, Relativity Media, Original Film, Metro-Goldwyn-Mayer, Stephen J. Cannell Productions, SJC Studios","When cops Schmidt and Jenko join the secret Jump Street unit, they use their youthful appearances to go undercover as high school students. They trade in their guns and badges for backpacks, and set out to shut down a dangerous drug ring. But, as time goes on, Schmidt and Jenko discover that high school is nothing like it was just a few years earlier -- and, what's more, they must again confront the teenage terror and anxiety they thought they had left behind.",21 Jump Street,"Reid, Zach",2012
4.16,Ming-Na Wen (Mulan (voice)),Eddie Murphy (Mushu (voice)),BD Wong (Shang (voice)),Miguel Ferrer (Shan-Yu (voice)),Harvey Fierstein (Yao (voice)),USA,"Tony Bancroft, Barry Cook","Family, Animation, Adventure",English,https://boxd.it/1VFw,https://a.ltrbxd.com/resized/sm/upload/tv/n8/6j/2r/mulan-1200-1200-675-675-crop-000000.jpg?v=f2d920b44b,88,"Walt Disney Feature Animation, Walt Disney Pictures","When Imperial China calls one man from every family to defend the empire from invading Huns, a young woman disguises herself as a soldier to take her ailing father’s place. Facing ruthless invaders, brutal training, and the risk of execution if discovered, she must decide who she truly is— and what she’s willing to fight for.",Mulan,"Reid, Zach",1998
2.97,Tom Hardy (Eddie Brock / Venom),Michelle Williams (Anne Weying),Riz Ahmed (Carlton Drake / Riot),Scott Haze (Security Chief Roland Treece),Reid Scott (Dr. Dan Lewis),China,Ruben Fleischer,"Science Fiction, Action",English,https://boxd.it/b8wA,https://a.ltrbxd.com/resized/sm/upload/re/nm/sa/19/venom-1200-1200-675-675-crop-000000.jpg?v=43773bc414,112,"Matt Tolmach Productions, Pascal Pictures, Marvel Entertainment, Tencent Pictures, Arad Productions, Columbia Pictures","Investigative journalist Eddie Brock attempts a comeback following a scandal, but accidentally becomes the host of Venom, a violent, super powerful alien symbiote. Soon, he must rely on his newfound powers to protect the world from a shadowy organization looking for a symbiote of their own.",Venom,"Reid, Zach",2018
4.14,Graham Chapman (King Arthur / Voice of God / Middle Head / Hiccoughing Guard),John Cleese (Second Swallow-Savvy Guard / The Black Knight / Peasant 3 / Sir Launcelot the Brave / Taunting French Guard / Tim the Enchanter),Eric Idle (Dead Collector / Peasant 1 / Sir Robin the Not-Quite-So-Brave-as-Sir Launcelot / First Swamp Castle Guard / Concorde / Roger the Shrubber / Brother Maynard),Terry Gilliam (Patsy / Green Knight / Old Man from Scene 24 (Bridgekeeper) / Sir Bors / Animator / Gorilla Hand),Terry Jones (Dennis's Mother / Sir Bedevere / Left Head / Prince Herbert / Voice of Cartoon Scribe),UK,"Terry Gilliam, Terry Jones","Fantasy, Comedy, Adventure",English,https://boxd.it/29GI,https://a.ltrbxd.com/resized/sm/upload/sx/qk/qr/pj/monty-python-holy-grail-1200-1200-675-675-crop-000000.jpg?v=c54aef6f32,91,"Python (Monty) Pictures Limited, Michael White Productions, National Film Trustee Company, EMI Films","King Arthur, accompanied by his squire, recruits his Knights of the Round Table, including Sir Bedevere the Wise, Sir Lancelot the Brave, Sir Robin the Not-Quite-So-Brave-As-Sir-Lancelot and Sir Galahad the Pure. On the way, Arthur battles the Black Knight who, despite having had all his limbs chopped off, insists he can still fight. They reach Camelot, but Arthur decides not to enter, as ""it is a silly place"".",Monty Python and the Holy Grail,"Reid, Zach",1975
2.73,Ryan Reynolds (Turbo (voice)),Paul Giamatti (Chet (voice)),Michael Peña (Tito (voice)),Samuel L. Jackson (Whiplash (voice)),Luis Guzmán (Angelo (voice)),USA,David Soren,"Family, Animation",English,https://boxd.it/2Hzw,https://a.ltrbxd.com/resized/sm/upload/au/0e/5x/6u/turbo-1200-1200-675-675-crop-000000.jpg?v=424c9cd19b,96,DreamWorks Animation,The tale of an ordinary garden snail who dreams of winning the Indy 500.,Turbo,"Reid, Zach",2013
3.41,Bill Hader (Flint Lockwood (voice)),Anna Faris (Sam Sparks (voice)),James Caan (Tim Lockwood (voice)),"Andy Samberg (""Baby"" Brent (voice))",Bruce Campbell (Mayor Shelbourne (voice)),USA,"Phil Lord, Christopher Miller","Animation, Comedy, Family",English,https://boxd.it/1A40,https://a.ltrbxd.com/resized/sm/upload/ey/7q/5s/m8/cloudy-1200-1200-675-675-crop-000000.jpg?v=ecafabeff5,90,"Sony Pictures Animation, Columbia Pictures","Inventor Flint Lockwood creates a machine that makes clouds rain food, enabling the down-and-out citizens of Chewandswallow to feed themselves. But when the falling food reaches gargantuan proportions, Flint must scramble to avert disaster. Can he regain control of the machine and put an end to the wild weather before the town is destroyed?",Cloudy with a Chance of Meatballs,"Reid, Zach",2009
2.97,Bill Hader (Flint Lockwood (voice)),Anna Faris (Sam Sparks (voice)),James Caan (Tim Lockwood (voice)),Will Forte (Chester V (voice)),Andy Samberg (Brent McHale (voice)),USA,"Kris Pearn, Cody Cameron","Comedy, Family, Animation",English,https://boxd.it/3GMw,https://a.ltrbxd.com/resized/sm/upload/xg/zl/p0/9z/cloudy-with-meatballs-2-1200-1200-675-675-crop-000000.jpg?v=ef76ba9e58,95,"Columbia Pictures, Sony Pictures Animation","After the disastrous food storm in the first film, Flint and his friends are forced to leave the town. Flint accepts the invitation from his idol Chester V to join The Live Corp Company, which has been tasked to clean the island, and where the best inventors in the world create technologies for the betterment of mankind. When Flint discovers that his machine still operates and now creates mutant food beasts like living pickles, hungry tacodiles, shrimpanzees and apple pie-thons, he and his friends must return to save the world.",Cloudy with a Chance of Meatballs 2,"Reid, Zach",2013
3.51,Jesse Eisenberg (Blu (voice)),Anne Hathaway (Jewel (voice)),Leslie Mann (Linda (voice)),Jane Lynch (Alice / Goose (voice)),will.i.am (Pedro (voice)),USA,Carlos Saldanha,"Comedy, Family, Adventure, Animation",English,https://boxd.it/NKc,https://a.ltrbxd.com/resized/alternative-backdrop/1/9/1/2/2/tmdb/bUXj5HETsJ7fW9sZlKv99k59GIz-1200-1200-675-675-crop-000000.jpg?v=72ca99bb50,96,"Blue Sky Studios, 20th Century Fox Animation","Captured by smugglers when he was just a hatchling, a macaw named Blu never learned to fly and lives a happily domesticated life in Minnesota with his human friend, Linda. Blu is thought to be the last of his kind, but when word comes that Jewel, a lone female, lives in Rio de Janeiro, Blu and Linda go to meet her. Animal smugglers kidnap Blu and Jewel, but the pair soon escape and begin a perilous adventure back to freedom -- and Linda.",Rio,"Reid, Zach",2011
3.65,Steve Carell (Gru (voice)),Jason Segel (Vector (voice)),Miranda Cosgrove (Margo (voice)),Dana Gaier (Edith (voice)),Elsie Fisher (Agnes (voice)),USA,"Pierre Coffin, Chris Renaud","Animation, Science Fiction, Comedy, Family, Crime",English,https://boxd.it/1DD8,https://a.ltrbxd.com/resized/sm/upload/r1/r0/me/zd/despicable-me-30-1200-1200-675-675-crop-000000.jpg?v=d6f414601c,95,"Illumination, Universal Pictures","Gru is a supervillain determined to prove he’s the greatest by stealing the Moon. To pull off his plan, he adopts three orphaned girls—Margo, Edith, and Agnes—intending to use them as part of his scheme. However, as Gru bonds with the girls, his cold, villainous exterior begins to melt.",Despicable Me,"Reid, Zach",2010
3.30,Steve Carell (Gru (voice)),Kristen Wiig (Lucy (voice)),Benjamin Bratt (Eduardo / El Macho (voice)),Miranda Cosgrove (Margo (voice)),Dana Gaier (Edith (voice)),USA,"Chris Renaud, Pierre Coffin","Comedy, Animation, Family",English,https://boxd.it/3gg0,https://a.ltrbxd.com/resized/sm/upload/27/0k/y5/yz/despicable-me-2-1200-1200-675-675-crop-000000.jpg?v=c07eabab9c,98,"Illumination, Universal Pictures",Gru is recruited by the Anti-Villain League to help deal with a powerful new super criminal.,Despicable Me 2,"Reid, Zach",2013
3.32,Tom Hanks (Hero Boy (Adult)/ Father / Conductor / Hobo / Scrooge / Santa Claus),Leslie Zemeckis (Sister Sarah / Mother),Eddie Deezen (Know-It-All),Nona Gaye (Hero Girl (voice)),Peter Scolari (Billy / Lonely Boy),USA,Robert Zemeckis,"Animation, Family, Adventure, Fantasy",English,https://boxd.it/23am,https://a.ltrbxd.com/resized/sm/upload/vw/kq/2s/y3/the-polar-express-1200-1200-675-675-crop-000000.jpg?v=a8bb4b6af2,100,"Golden Mean, Playtone, ImageMovers, Castle Rock Entertainment, Shangri-La Entertainment","When a doubting young boy takes an extraordinary train ride to the North Pole, he embarks on a journey of self-discovery that shows him that the wonder of life never fades for those who believe.",The Polar Express,"Reid, Zach",2004
3.90,Scott Weinger (Aladdin (voice)),Robin Williams (Genie / Peddler (voice)),Linda Larkin (Jasmine (voice)),Jonathan Freeman (Jafar (voice)),Gilbert Gottfried (Iago (voice)),USA,"John Musker, Ron Clements","Fantasy, Adventure, Romance, Family, Animation",English,https://boxd.it/29yE,https://a.ltrbxd.com/resized/sm/upload/8v/v0/f7/6z/aladdin-1200-1200-675-675-crop-000000.jpg?v=4749cb2e4b,91,Walt Disney Feature Animation,"In the boorish city of Agrabah, kind-hearted street urchin Aladdin and Princess Jasmine fall in love, although she can only marry a prince. He and power-hungry Grand Vizier Jafar vie for a magic lamp that can fulfill their wishes.",Aladdin,"Reid, Zach",1992
3.60,Ray Romano (Manfred 'Manny' (voice)),John Leguizamo (Sid (voice)),Denis Leary (Diego (voice)),Goran Višnjić (Soto (voice)),Jack Black (Zeke (voice)),USA,Chris Wedge,"Comedy, Adventure, Family, Animation",English,https://boxd.it/2apS,https://a.ltrbxd.com/resized/sm/upload/7l/o4/09/6a/ice-age-30-1200-1200-675-675-crop-000000.jpg?v=231e192723,82,"Blue Sky Studios, 20th Century Fox","Manny the mammoth, Sid the loquacious sloth, and Diego the sabre-toothed tiger go on a comical quest to return a human baby back to his father, across a world on the brink of an ice age.",Ice Age,"Reid, Zach",2002
3.86,Jay Baruchel (Hiccup (voice)),Cate Blanchett (Valka (voice)),Gerard Butler (Stoick (voice)),Craig Ferguson (Gobber (voice)),America Ferrera (Astrid (voice)),USA,Dean DeBlois,"Animation, Adventure, Action, Fantasy, Family",English,https://boxd.it/2TRW,https://a.ltrbxd.com/resized/sm/upload/gr/n4/vo/kp/how-to-train-your-dragon-2-1200-1200-675-675-crop-000000.jpg?v=91f8dbaaa1,102,DreamWorks Animation,"Five years after uniting the dragons and Vikings of Berk, Hiccup and Toothless soar beyond their homeland, charting the vast unknown. During one of their adventures, the pair discover a secret cave that houses hundreds of wild dragons -- and a mysterious dragon rider with a startling connection to Hiccup. And as the ruthless dragon conqueror Drago Bludvist rises to seize control of both dragons and people alike, Hiccup must step into his role as a true leader and, alongside his friends and Toothless, protect Berk from a devastating war.",How to Train Your Dragon 2,"Reid, Zach",2014
3.51,Billy Crystal (Mike (voice)),John Goodman (Sullivan (voice)),Steve Buscemi (Randy (voice)),Helen Mirren (Dean Hardscrabble (voice)),Peter Sohn (Squishy (voice)),USA,Dan Scanlon,"Animation, Fantasy, Family, Comedy",English,https://boxd.it/bQm,https://a.ltrbxd.com/resized/sm/upload/ud/rm/sk/uo/monsters-university-1200-1200-675-675-crop-000000.jpg?v=bb32a2264e,104,Pixar,A look at the relationship between Mike and Sulley during their days at Monsters University — when they weren't necessarily the best of friends.,Monsters University,"Reid, Zach",2013
