average_rating,cast_1,cast_2,cast_3,cast_4,cast_5,country,director,genres,language,letterboxd_uri,poster_url,runtime,studio,synopsis,title,watched_by,year
3.38,Ewan McGregor (Rodney Copperbottom (voice)),Halle Berry (Cappy (voice)),Greg Kinnear (Ratchet (voice)),Mel Brooks (Bigweld (voice)),Drew Carey (Crank (voice)),USA,Chris Wedge,"Science Fiction, Animation, Comedy, Family",English,https://boxd.it/1Xve,https://a.ltrbxd.com/resized/sm/upload/i2/1i/o9/hf/robots-120-1200-1200-675-675-crop-000000.jpg?v=e9bd44e938,90,"Blue Sky Studios, 20th Century Fox Animation, 20th Century Fox","Rodney Copperbottom is a young robot inventor who dreams of making the world a better place, until the evil Ratchet takes over Bigweld Industries. Now, Rodney's dreams – and those of his friends – are in danger of becoming obsolete.",Robots,"Reid, Zach",2005
2.88,Zach Braff (Chicken Little (voice)),Garry Marshall (Buck Cluck (voice)),Don Knotts (Mayor Turkey Lurkey (voice)),Amy Sedaris (Foxy Loxy (voice)),Steve Zahn (Runt of the Litter (voice)),USA,Mark Dindal,"Animation, Comedy, Family",English,https://boxd.it/1Xnu,https://a.ltrbxd.com/resized/sm/upload/sh/r4/um/kg/chicken-little-1200-1200-675-675-crop-000000.jpg?v=fdd377dde9,81,"Walt Disney Pictures, Walt Disney Feature Animation","When the sky really is falling and sanity has flown the coop, who will rise to save the day? Together with his hysterical band of misfit friends, Chicken Little must hatch a plan to save the planet from alien invasion and prove that the world's biggest hero is a little chicken.",Chicken Little,"Reid, Zach",2005
3.06,Tommy Lee Jones (Kay),Will Smith (Jay),Rip Torn (Zed),Lara Flynn Boyle (Serleena),Johnny Knoxville (Scrad / Charlie),USA,Barry Sonnenfeld,"Science Fiction, Comedy, Action",English,https://boxd.it/2a0y,https://a.ltrbxd.com/resized/sm/upload/ff/w5/52/0g/mib2-1200-1200-675-675-crop-000000.jpg?v=0c77e0a9f4,88,"Columbia Pictures, Amblin Entertainment, MacDonald/Parkes Productions","Kay and Jay reunite to provide our best, last and only line of defense against a sinister seductress who levels the toughest challenge yet to the MIB's untarnished mission statement – protecting Earth from the scum of the universe. It's been four years since the alien-seeking agents averted an intergalactic disaster of epic proportions. Now it's a race against the clock as Jay must convince Kay – who not only has absolutely no memory of his time spent with the MIB, but is also the only living person left with the expertise to save the galaxy – to reunite with the MIB before the earth submits to ultimate destruction.",Men in Black II,"Reid, Zach",2002
3.19,Will Smith (Agent J),Tommy Lee Jones (Agent K),Josh Brolin (Young Agent K),Jemaine Clement (Boris The Animal),Emma Thompson (Agent O),United Arab Emirates,Barry Sonnenfeld,"Comedy, Action, Science Fiction",English,https://boxd.it/103U,https://a.ltrbxd.com/resized/sm/upload/p2/8y/3f/jn/mib3-1200-1200-675-675-crop-000000.jpg?v=597a1f2504,106,"Columbia Pictures, Hemisphere Media Capital, Amblin Entertainment, Parkes+MacDonald Image Nation, Image Nation Abu Dhabi","Agents J and K are back...in time. J has seen some inexplicable things in his 15 years with the Men in Black, but nothing, not even aliens, perplexes him as much as his wry, reticent partner. But when K's life and the fate of the planet are put at stake, Agent J will have to travel back in time to put things right. J discovers that there are secrets to the universe that K never told him - secrets that will reveal themselves as he teams up with the young Agent K to save his partner, the agency, and the future of humankind.",Men in Black 3,"Reid, Zach",2012
3.06,Elijah Wood (Mumble (voice)),Robin Williams (Ramon / Lovelace (voice)),Brittany Murphy (Gloria (voice)),Hugh Jackman (Memphis (voice)),Nicole Kidman (Norma Jean (voice)),Australia,George Miller,"Family, Animation, Comedy",English,https://boxd.it/1XH0,https://a.ltrbxd.com/resized/sm/upload/jo/iq/8u/nk/happy-feet-1200-1200-675-675-crop-000000.jpg?v=683eaff163,108,"Kennedy Miller Productions, Animal Logic, Village Roadshow Pictures, Warner Bros. Pictures","Into the world of the Emperor Penguins, who find their soul mates through song, a penguin is born who cannot sing. But he can tap dance something fierce!",Happy Feet,"Reid, Zach",2006
3.12,Owen Wilson (Lightning McQueen (voice)),Cristela Alonzo (Cruz Ramirez (voice)),Chris Cooper (Smokey (voice)),Nathan Fillion (Sterling (voice)),Larry the Cable Guy (Mater (voice)),USA,Brian Fee,"Family, Drama, Animation",English,https://boxd.it/7IPq,https://a.ltrbxd.com/resized/sm/upload/kd/am/4j/9n/cars-3-1200-1200-675-675-crop-000000.jpg?v=cf38f6e67e,102,Pixar,"Blindsided by a new generation of blazing-fast racers, the legendary Lightning McQueen is suddenly pushed out of the sport he loves. To get back in the game, he will need the help of an eager young race technician with her own plan to win, inspiration from the late Fabulous Hudson Hornet, and a few unexpected turns.",Cars 3,"Reid, Zach",2017
3.10,Anna Kendrick (Beca Mitchell),Brittany Snow (Chloe Beale),Hailee Steinfeld (Emily Junk),Rebel Wilson (Fat Amy),Ester Dean (Cynthia Rose),USA,Elizabeth Banks,"Comedy, Music",English,https://boxd.it/7tNa,https://a.ltrbxd.com/resized/sm/upload/tj/7f/7e/22/pitch-perfect-2-1200-1200-675-675-crop-000000.jpg?v=a571139f98,115,"Brownstone Productions, Gold Circle Films, Universal Pictures","The Bellas are back, and they are better than ever. After being humiliated in front of none other than the President of the United States of America, the Bellas are taken out of the Aca-Circuit. In order to clear their name, and regain their status, the Bellas take on a seemingly impossible task: winning an international competition no American team has ever won. In order to accomplish this monumental task, they need to strengthen the bonds of friendship and sisterhood and blow away the competition with their amazing aca-magic! With all new friends and old rivals tagging along for the trip, the Bellas can hopefully accomplish their dreams.",Pitch Perfect 2,"Reid, Zach",2015
3.29,Will Ferrell (Detective Allen Gamble),Mark Wahlberg (Detective Terry Hoitz),Eva Mendes (Sheila Gamble),Michael Keaton (Captain Gene Mauch),Steve Coogan (David Ershon),USA,Adam McKay,"Comedy, Action",English,https://boxd.it/1rtq,https://a.ltrbxd.com/resized/sm/upload/yh/4n/0t/4v/other-guys-1200-1200-675-675-crop-000000.jpg?v=c47abd1b5a,107,"Columbia Pictures, Gary Sanchez Productions, Mosaic Media Group","Unlike their heroic counterparts on the force, desk-bound NYPD detectives Gamble and Hoitz garner no headlines as they work day to day. When a seemingly minor case turns out to be a big deal, the two cops get the opportunity to finally prove to their comrades that they have the right stuff.",The Other Guys,"Reid, Zach",2010
3.34,Ben Stiller (Greg Focker),Robert De Niro (Jack Byrnes),Teri Polo (Pam Byrnes),Blythe Danner (Dina Byrnes),Nicole DeHuff (Debbie Byrnes),USA,Jay Roach,"Comedy, Romance",English,https://boxd.it/28vE,https://a.ltrbxd.com/resized/sm/upload/py/nx/0v/lp/meet-the-parents-1200-1200-675-675-crop-000000.jpg?v=b675917d99,108,"Universal Pictures, DreamWorks Pictures, Nancy Tenenbaum Films, Tribeca Productions","Greg Focker is ready to marry his girlfriend, Pam, but before he pops the question, he must win over her formidable father, humorless former CIA agent Jack Byrnes, at the wedding of Pam's sister. As Greg bends over backward to make a good impression, his visit to the Byrnes home turns into a hilarious series of disasters, and everything that can go wrong does, all under Jack's critical, hawklike gaze.",Meet the Parents,"Reid, Zach",2000
3.06,Alexa PenaVega (Carmen Cortez),Daryl Sabara (Juni Cortez),Antonio Banderas (Gregorio Cortez),Carla Gugino (Ingrid Cortez),Alan Cumming (Fegan Floop),USA,Robert Rodriguez,"Family, Science Fiction, Adventure, Comedy, Action",English,https://boxd.it/1Xcw,https://a.ltrbxd.com/resized/sm/upload/dt/q6/fl/v2/spy-kids-1200-1200-675-675-crop-000000.jpg?v=1b22b63119,88,"Troublemaker Studios, Dimension Films, Miramax","Carmen and Juni think their parents are boring. Little do they know that in their day, Gregorio and Ingrid Cortez were the top secret agents from their respective countries. They gave up that life to raise their children. Now, the disappearances of several of their old colleagues forces the Cortez' return from retirement. What they didn't count on was Carmen and Juni joining the ""family business.""",Spy Kids,"Reid, Zach",2001
3.63,Daniel Hansen (Lewis (voice)),Jordan Fry (Lewis (voice)),Wesley Singerman (Wilbur (voice)),Matthew Josten (Michael 'Goob' Yagoobian (voice)),Stephen J. Anderson (Bowler Hat Guy / Grandpa Bud / Tallulah (voice)),USA,Stephen J. Anderson,"Animation, Family, Comedy, Science Fiction, Adventure",English,https://boxd.it/28Ym,https://a.ltrbxd.com/resized/sm/upload/pw/ub/9l/vu/meet-the-robinsons-220-1200-1200-675-675-crop-000000.jpg?v=72595bcde8,95,"Walt Disney Animation Studios, Walt Disney Pictures","Lewis, a brilliant young inventor, is keen on creating a time machine to find his mother, who abandoned him in an orphanage. Things take a turn when he meets Wilbur Robinson and his family.",Meet the Robinsons,"Reid, Zach",2007
3.35,Bruce Willis (RJ (voice)),Garry Shandling (Verne (voice)),Steve Carell (Hammy (voice)),Wanda Sykes (Stella (voice)),William Shatner (Ozzie (voice)),USA,"Karey Kirkpatrick, Tim Johnson","Animation, Family, Adventure, Comedy",English,https://boxd.it/20QY,https://a.ltrbxd.com/resized/sm/upload/5m/bo/d6/36/over-the-hedge-1200-1200-675-675-crop-000000.jpg?v=2e6bc708ca,83,DreamWorks Animation,"A scheming raccoon fools a mismatched family of forest creatures into helping him repay a debt of food, by invading the new suburban sprawl that popped up while they were hibernating – and learns a lesson about family himself.",Over the Hedge,"Reid, Zach",2006
3.56,Andy Samberg (Rod Kimble),Jorma Taccone (Kevin Powell),Bill Hader (Dave),Danny McBride (Rico),Isla Fisher (Denise),USA,Akiva Schaffer,"Action, Comedy",English,https://boxd.it/1X9C,https://a.ltrbxd.com/resized/sm/upload/vc/43/v7/fl/hot-rod-1200-1200-675-675-crop-000000.jpg?v=3428088136,88,"Paramount Pictures, Broadway Video, Michaels-Goldwyn, The Lonely Island","For Rod Kimble, performing stunts is a way of life, even though he is rather accident-prone. Poor Rod cannot even get any respect from his stepfather, Frank, who beats him up in weekly sparring matches. When Frank falls ill, Rod devises his most outrageous stunt yet to raise money for Frank's operation -- and then Rod will kick Frank's butt.",Hot Rod,"Reid, Zach",2007
2.96,Ben Stiller (Larry Daley),Amy Adams (Amelia Earhart),Owen Wilson (Jedediah Smith),Hank Azaria (Kahmunrah / The Thinker / Abe Lincoln),Robin Williams (Theodore Roosevelt),USA,Shawn Levy,"Family, Adventure, Comedy, Fantasy, Action",English,https://boxd.it/1H7U,https://a.ltrbxd.com/resized/sm/upload/cu/uy/ih/7v/night-museum-2-1200-1200-675-675-crop-000000.jpg?v=8edaaf65ad,105,"21 Laps Entertainment, 1492 Pictures, Dune Entertainment, 20th Century Fox","Hapless museum night watchman Larry Daley must help his living, breathing exhibit friends out of a pickle now that they've been transferred to the archives at the Smithsonian Institution. Larry's (mis)adventures this time include close encounters with Amelia Earhart, Abe Lincoln and Ivan the Terrible.",Night at the Museum: Battle of the Smithsonian,"Reid, Zach",2009
3.24,Hugh Jackman (Roddy (voice)),Kate Winslet (Rita (voice)),Ian McKellen (The Toad (voice)),Jean Reno (Le Frog (voice)),Bill Nighy (Whitey (voice)),UK,"David Bowers, Sam Fell","Family, Adventure, Comedy, Animation",English,https://boxd.it/1Tpm,https://a.ltrbxd.com/resized/sm/upload/hi/36/6p/bi/flushed-away-1200-1200-675-675-crop-000000.jpg?v=60ebd017d1,85,"DreamWorks Animation, Aardman","London high-society mouse, Roddy is flushed down the toilet by Sid, a common sewer rat. Hang on for a madcap adventure deep in the sewer bowels of Ratropolis, where Roddy meets the resourceful Rita, the rodent-hating Toad and his faithful thugs, Spike and Whitey.",Flushed Away,"Reid, Zach",2006
2.85,Jason Lee (Dave),David Cross (Ian),Cameron Richardson (Claire),Jane Lynch (Gail),Justin Long (Alvin (voice)),USA,Tim Hill,"Fantasy, Animation, Family, Comedy",English,https://boxd.it/21E0,https://a.ltrbxd.com/resized/sm/upload/ht/th/ok/t8/alvin-and-the-chipmunks-80-1200-1200-675-675-crop-000000.jpg?v=a179d9ba8d,92,"Fox 2000 Pictures, Regency Enterprises, Bagdasarian Productions, Dune Entertainment, 20th Century Fox","A struggling songwriter named Dave Seville finds success when he comes across a trio of singing chipmunks: mischievous leader Alvin, brainy Simon, and chubby, impressionable Theodore.",Alvin and the Chipmunks,"Reid, Zach",2007
2.77,Anna Kendrick (Cinderella),Meryl Streep (Witch),Lilla Crawford (Little Red Riding Hood),James Corden (Baker),Emily Blunt (Baker's Wife),USA,Rob Marshall,"Comedy, Fantasy",English,https://boxd.it/6DtW,https://a.ltrbxd.com/resized/sm/upload/z9/ya/na/bf/into-the-woods-2014-1200-1200-675-675-crop-000000.jpg?v=3d0ac10554,125,"Walt Disney Pictures, Marc Platt Productions, Lucamar Productions","In a woods filled with magic and fairy tale characters, a baker and his wife set out to end the curse put on them by their neighbor, a spiteful witch.",Into the Woods,"Reid, Zach",2014
2.77,Mike Myers (The Cat),Dakota Fanning (Sally Walden),Spencer Breslin (Conrad Walden),Kelly Preston (Joan Walden),Alec Baldwin (Larry Quinn),USA,Bo Welch,"Comedy, Fantasy, Adventure, Family",English,https://boxd.it/1VSU,https://a.ltrbxd.com/resized/sm/upload/ks/av/ai/3d/the-cat-in-the-hat-1200-1200-675-675-crop-000000.jpg?v=e6acfb429d,82,"Universal Pictures, DreamWorks Pictures, Imagine Entertainment, Brian Grazer Productions","During a rainy day, and while their mother is out, Conrad and Sally, and their pet fish, are visited by the mischievous Cat in the Hat. Fun soon turns to mayhem, and the siblings must figure out how to rid themselves of the maniacal Cat.",The Cat in the Hat,"Reid, Zach",2003
3.42,Mel Brooks (President Skroob / Yogurt),John Candy (Barf),Rick Moranis (Dark Helmet),Bill Pullman (Lone Starr),Daphne Zuniga (Princess Vespa),USA,Mel Brooks,"Science Fiction, Comedy",English,https://boxd.it/29cy,https://a.ltrbxd.com/resized/sm/upload/yv/ku/4p/4l/spaceballs-40-1200-1200-675-675-crop-000000.jpg?v=c7c2ba416e,96,"Metro-Goldwyn-Mayer, Brooksfilms","When the nefarious Dark Helmet hatches a plan to snatch Princess Vespa and steal her planet's air, space-bum-for-hire Lone Starr and his clueless sidekick fly to the rescue. Along the way, they meet Yogurt, who puts Lone Starr wise to the power of ""The Schwartz."" Can he master it in time to save the day?",Spaceballs,"Reid, Zach",1987
2.67,Steve Carell (Gru / Dru (voice)),Kristen Wiig (Lucy Wilde (voice)),Trey Parker (Balthazar Bratt (voice)),Miranda Cosgrove (Margo (voice)),Dana Gaier (Edith (voice)),USA,"Kyle Balda, Pierre Coffin","Action, Animation, Adventure, Comedy, Family",English,https://boxd.it/azpu,https://a.ltrbxd.com/resized/sm/upload/co/ol/dv/lm/despicable-me-3-1200-1200-675-675-crop-000000.jpg?v=ba2f01d4da,90,"Illumination, Universal Pictures",Gru and his wife Lucy must stop former '80s child star Balthazar Bratt from achieving world domination.,Despicable Me 3,"Reid, Zach",2017
3.78,Shia LaBeouf (Cody Maverick (voice)),Jeff Bridges (Big Z / Geek (voice)),Zooey Deschanel (Lani Aliikai (voice)),Jon Heder (Chicken Joe (voice)),James Woods (Reggie Belafonte (voice)),USA,"Ash Brannon, Chris Buck","Comedy, Animation, Family",English,https://boxd.it/1YKY,https://a.ltrbxd.com/resized/sm/upload/n8/rm/du/uq/surfs-up-1200-1200-675-675-crop-000000.jpg?v=c25c619246,85,"Columbia Pictures, Sony Pictures Animation","With a documentary crew in tow, Cody Maverick—a young surfer from Antarctica—travels to the pacific for his first professional competition. Determined to earn respect and live up to his idol, Big Z, Cody pushes himself to the limit. But all that changes when an encounter with a laid-back local forces him to rethink his values.",Surf's Up,"Reid, Zach",2007
3.32,Zachary Gordon (Greg Heffley),Robert Capron (Rowley Jefferson),Steve Zahn (Frank Heffley),Devon Bostick (Rodrick Heffley),Rachael Harris (Susan Heffley),UK,Thor Freudenthal,"Comedy, Family",English,https://boxd.it/1fUa,https://a.ltrbxd.com/resized/sm/upload/6c/05/sp/42/diary-of-a-wimpy-kid-1200-1200-675-675-crop-000000.jpg?v=ea2fd720fa,92,"Dayday Films, Color Force, Dune Entertainment, Fox 2000 Pictures","Greg Heffley is headed for big things, but first he has to survive the scariest, most humiliating experience of any kid’s life – middle school! That won’t be easy, considering he’s surrounded by hairy-freckled morons, wedgie-loving bullies and a moldy slice of cheese with nuclear cooties!",Diary of a Wimpy Kid,"Reid, Zach",2010
2.75,Dwayne Johnson (Bob Stone),Kevin Hart (Calvin Joyner),Amy Ryan (Pamela Harris),Danielle Nicolet (Maggie),Jason Bateman (Trevor),USA,Rawson Marshall Thurber,"Comedy, Action",English,https://boxd.it/9DFE,https://a.ltrbxd.com/resized/sm/upload/tc/t7/kd/uk/central-intelligence-1200-1200-675-675-crop-000000.jpg?v=d85cc5df0c,107,"New Line Cinema, Bluegrass Films, RatPac Entertainment, Principato-Young Entertainment, Perfect World Pictures","Calvin Joyner, a mild-mannered accountant whose high school glory days are long behind him, reconnects with an awkward pal from high school through Facebook. After meeting up, Calvin’s mundane life takes an unexpectedly thrilling turn when he's thrust into the world of international espionage.",Central Intelligence,"Reid, Zach",2016
2.67,Anna Kendrick (Beca Mitchell),"Rebel Wilson (Patricia ""Fat Amy"" Hobart)",Brittany Snow (Chloe Beale),Hailee Steinfeld (Emily Junk),Elizabeth Banks (Gail),USA,Trish Sie,"Music, Comedy",English,https://boxd.it/bUre,https://a.ltrbxd.com/resized/sm/upload/9h/ur/a0/xv/pitch-perfect-3-1200-1200-675-675-crop-000000.jpg?v=bd361e08f6,93,"Gold Circle Films, Brownstone Productions","After the highs of winning the world championships, the Bellas find themselves split apart and discovering there aren't job prospects for making music with your mouth. But when they get the chance to reunite for an overseas USO tour, this group of awesome nerds will come together to make some music, and some questionable decisions, one last time.",Pitch Perfect 3,"Reid, Zach",2017
3.78,Zachary Gordon (Greg Heffley),Devon Bostick (Rodrick Heffley),Robert Capron (Rowley Jefferson),Steve Zahn (Frank Heffley),Rachael Harris (Susan Heffley),USA,David Bowers,"Family, Comedy",English,https://boxd.it/gm2,https://a.ltrbxd.com/resized/sm/upload/cm/jn/xa/yz/wimpy-kid-1200-1200-675-675-crop-000000.jpg?v=6d19266477,99,"Color Force, Dune Entertainment, Fox 2000 Pictures","Wimpy Greg Heffley, now in seventh grade, thinks he has it all together. He has mastered middle school and gotten rid of the Cheese Touch. However, Greg's older brother, Rodrick, is itching to cut him down to size. He gets the perfect opportunity when their mother tries to force the boys to bond. Rodrick may be Greg's chief tormentor, but he feels his constant pranks are just what his little brother needs to prepare him for life's hard knocks.",Diary of a Wimpy Kid: Rodrick Rules,"Reid, Zach",2011
3.80,Tom Guiry (Scotty Smalls),Mike Vitar (Benjamin Franklin Rodriguez),Patrick Renna (Hamilton 'Ham' Porter),Chauncey Leopardi (Michael 'Squints' Palledorous),Marty York (Alan 'Yeah-Yeah' McClennan),USA,David Mickey Evans,"Family, Comedy, Drama",English,https://boxd.it/1TDy,https://a.ltrbxd.com/resized/sm/upload/tb/go/ee/6p/sandlot-1200-1200-675-675-crop-000000.jpg?v=cd00dc53cf,101,"Island World, 20th Century Fox","During a summer of friendship and adventure, one boy becomes a part of the gang, nine boys become a team and their leader becomes a legend by confronting the terrifying mystery beyond the right field wall.",The Sandlot,"Reid, Zach",1993
2.93,Glenn Close (Cruella de Vil),Jeff Daniels (Roger),Joely Richardson (Anita),Joan Plowright (Nanny),Hugh Laurie (Jasper),UK,Stephen Herek,"Family, Comedy",English,https://boxd.it/1TgO,https://a.ltrbxd.com/resized/sm/upload/ch/ew/o8/jr/101-dalmations-1200-1200-675-675-crop-000000.jpg?v=0e88a7e187,103,"Great Oaks Entertainment, Walt Disney Pictures, Wizzer Productions","An evil, high-fashion designer plots to steal Dalmatian puppies in order to make an extravagant fur coat, but instead creates an extravagant mess.",101 Dalmatians,"Reid, Zach",1996
2.88,Ben Stiller (Larry Daley / Laaa),Robin Williams (Theodore Roosevelt),Owen Wilson (Jedediah Smith),Steve Coogan (Octavius),Ricky Gervais (Dr. McPhee),UK,Shawn Levy,"Comedy, Family, Adventure, Fantasy",English,https://boxd.it/5x3m,https://a.ltrbxd.com/resized/sm/upload/34/t1/pm/qo/night-at-the-museum-secret-of-the-tomb-1200-1200-675-675-crop-000000.jpg?v=c6dd438c19,98,"Moving Picture Company, 21 Laps Entertainment, 1492 Pictures, TSG Entertainment, 20th Century Fox","When the magic powers of The Tablet of Ahkmenrah begin to die out, Larry Daley spans the globe, uniting favorite and new characters while embarking on an epic quest to save the magic before it is gone forever.",Night at the Museum: Secret of the Tomb,"Reid, Zach",2014
3.20,Rick Moranis (Wayne Szalinski),Matt Frewer (Big Russ Thompson),Marcia Strassman (Diane Szalinski),Kristine Sutherland (Mae Thompson),Thomas Wilson Brown (Little Russ Thompson),USA,Joe Johnston,"Science Fiction, Adventure, Comedy, Family",English,https://boxd.it/1YTw,https://a.ltrbxd.com/resized/sm/upload/36/th/kz/ea/honey-i-shrunk-kids-1200-1200-675-675-crop-000000.jpg?v=22d2da954a,93,"Walt Disney Pictures, Silver Screen Partners III",The scientist father of a teenage girl and boy accidentally shrinks his and two other neighborhood teens to the size of insects. Now the teens must fight diminutive dangers as the father searches for them.,"Honey, I Shrunk the Kids","Reid, Zach",1989
2.88,Vince Vaughn (Billy McMahon),Owen Wilson (Nick Campbell),Rose Byrne (Dana Simms),Aasif Mandvi (Roger Chetty),Max Minghella (Graham Hawtrey),USA,Shawn Levy,Comedy,English,https://boxd.it/3SWS,https://a.ltrbxd.com/resized/sm/upload/4y/hr/ty/s0/the-internship-1200-1200-675-675-crop-000000.jpg?v=72e20ddaf9,119,"TSG Entertainment, Regency Enterprises, Wild West Picture Show Productions, 21 Laps Entertainment, 20th Century Fox",Two recently laid-off men in their 40s try to make it as interns at a successful Internet company where their managers are in their 20s.,The Internship,"Reid, Zach",2013
3.19,Steve Martin (Tom Baker),Bonnie Hunt (Kate Baker),Hilary Duff (Lorraine Baker),Tom Welling (Charlie Baker),Piper Perabo (Nora Baker),USA,Shawn Levy,"Comedy, Family, Drama",English,https://boxd.it/1USa,https://a.ltrbxd.com/resized/sm/upload/vf/se/fe/a6/cheaper-by-the-dozen-1200-1200-675-675-crop-000000.jpg?v=83e5f970ea,98,"20th Century Fox, Robert Simonds Productions","The Baker brood moves to Chicago after patriarch Tom gets a job coaching football at Northwestern University, forcing his writer wife, Kate, and the couple's 12 children to make a major adjustment. The transition works well until work demands pull the parents away from home, leaving the kids bored -- and increasingly mischievous.",Cheaper by the Dozen,"Reid, Zach",2003
2.81,Anna Kendrick (Poppy (voice)),Justin Timberlake (Branch (voice)),Zooey Deschanel (Bridget (voice)),Christopher Mintz-Plasse (King Gristle (voice)),Christine Baranski (Chef (voice)),USA,Mike Mitchell,"Fantasy, Animation, Comedy, Family, Adventure, Music",English,https://boxd.it/4p8Q,https://a.ltrbxd.com/resized/sm/upload/u6/kl/dz/ry/trolls-1200-1200-675-675-crop-000000.jpg?v=c25f4151e9,92,DreamWorks Animation,"After the monstrous Bergens invade Troll Village, Princess Poppy, the happiest Troll ever born, and overly-cautious, curmudgeonly outcast Branch set off on a journey to rescue her friends. Their mission is full of adventure and mishaps, as this mismatched duo try to tolerate each other long enough to get the job done.",Trolls,"Reid, Zach",2016
2.50,Steve Carell (Evan Baxter),Morgan Freeman (God),Lauren Graham (Joan Baxter),Johnny Simmons (Dylan Baxter),Graham Phillips (Jordan Baxter),USA,Tom Shadyac,"Comedy, Family, Fantasy",English,https://boxd.it/26s4,https://a.ltrbxd.com/resized/sm/upload/5d/8p/s8/2g/evan-almighty-1200-1200-675-675-crop-000000.jpg?v=a08b70f50f,96,"Universal Pictures, Spyglass Entertainment, Relativity Media, Shady Acres Entertainment, Original Film",God contacts Junior Congressman Evan Baxter and tells him to build an ark in preparation for a great flood.,Evan Almighty,"Reid, Zach",2007
2.54,Zachary Levi (Toby),David Cross (Ian),Jason Lee (Dave),Justin Long (Alvin (voice)),Matthew Gray Gubler (Simon (voice)),USA,Betty Thomas,"Family, Animation, Fantasy, Music, Comedy",English,https://boxd.it/1zgk,https://a.ltrbxd.com/resized/sm/upload/5a/8w/i9/zj/alvin-and-the-chipmunks-the-squequel-1200-1200-675-675-crop-000000.jpg?v=6138823235,89,"Fox 2000 Pictures, Bagdasarian Productions, Regency Enterprises, 20th Century Fox, Dune Entertainment","Pop sensations Alvin, Simon and Theodore end up in the care of Dave Seville's twenty-something nephew Toby. The boys must put aside music super stardom to return to school, and are tasked with saving the school's music program by winning the $25,000 prize in a battle of the bands. But the Chipmunks unexpectedly meet their match in three singing chipmunks known as The Chipettes - Brittany, Eleanor and Jeanette. Romantic and musical sparks are ignited when the Chipmunks and Chipettes square off.",Alvin and the Chipmunks: The Squeakquel,"Reid, Zach",2009
