average_rating,cast_1,cast_2,cast_3,cast_4,cast_5,country,director,genres,language,letterboxd_uri,poster_url,runtime,studio,synopsis,title,watched_by,year
3.11,Hayden Christensen (Anakin Skywalker),Ewan McGregor (Obi-Wan Kenobi),Natalie Portman (Padmé Amidala),Christopher Lee (Count Dooku),Samuel L. Jackson (Mace Windu),USA,George Lucas,"Science Fiction, Adventure, Action",English,https://boxd.it/27V2,https://a.ltrbxd.com/resized/sm/upload/t8/jn/ez/5u/attack-of-the-clones-1200-1200-675-675-crop-000000.jpg?v=d7991186bc,142,Lucasfilm Ltd.,"Following an assassination attempt on Senator Padmé Amidala, Jedi Knights Anakin Skywalker and Obi-Wan Kenobi investigate a mysterious plot into the heart of the Separatist movement and the beginning of the Clone Wars.",Star Wars: Episode II – Attack of the Clones,"Reid, Zach",2002
3.59,Macaulay Culkin (Kevin),Joe Pesci (Harry),Daniel Stern (Marv),Catherine O'Hara (Kate),John Heard (Peter),USA,Chris Columbus,"Family, Comedy, Adventure",English,https://boxd.it/29F6,https://a.ltrbxd.com/resized/sm/upload/tx/ew/4p/qe/home%20alone%2022-1200-1200-675-675-crop-000000.jpg?v=48de3619c6,120,"20th Century Fox, Hughes Entertainment","Instead of flying to Florida with his folks, Kevin ends up alone in New York, where he gets a hotel room with his dad's credit card—despite problems from a clerk and meddling bellboy. But when Kevin runs into his old nemeses, the Wet Bandits, he's determined to foil their plans to rob a toy store on Christmas Eve.",Home Alone 2: Lost in New York,"Reid, Zach",1992
2.28,Chris Pratt (Owen Grady),Bryce Dallas Howard (Claire Dearing),Laura Dern (Ellie Sattler),Sam Neill (Alan Grant),Jeff Goldblum (Ian Malcolm),USA,Colin Trevorrow,"Thriller, Science Fiction, Adventure",English,https://boxd.it/ikXW,https://a.ltrbxd.com/resized/sm/upload/hs/6k/hd/z6/jurassic-world-dominion-1200-1200-675-675-crop-000000.jpg?v=8ed9a0c604,147,"Amblin Entertainment, Universal Pictures","Four years after Isla Nublar was destroyed, dinosaurs now live—and hunt—alongside humans all over the world. This fragile balance will reshape the future and determine, once and for all, whether human beings are to remain the apex predators on a planet they now share with history's most fearsome creatures.",Jurassic World Dominion,"Reid, Zach",2022
3.13,Jeff Goldblum (Ian Malcolm),Julianne Moore (Sarah Harding),Pete Postlethwaite (Roland Tembo),Arliss Howard (Peter Ludlow),Richard Attenborough (John Hammond),USA,Steven Spielberg,"Science Fiction, Action, Adventure",English,https://boxd.it/2azS,https://a.ltrbxd.com/resized/sm/upload/a8/6m/va/pq/the-lost-world-jurassic-park-1200-1200-675-675-crop-000000.jpg?v=77dfd20401,129,"Universal Pictures, Amblin Entertainment","Four years after Jurassic Park's genetically bred dinosaurs ran amok, multimillionaire John Hammond shocks chaos theorist Ian Malcolm by revealing that he has been breeding more beasties at a secret location. Malcolm, his paleontologist ladylove and a wildlife videographer join an expedition to document the lethal lizards' natural behavior in this action-packed thriller.",The Lost World: Jurassic Park,"Reid, Zach",1997
3.35,Tom Cruise (Ray),Dakota Fanning (Rachel),Miranda Otto (Mary Ann),Justin Chatwin (Robbie),Tim Robbins (Harlan Ogilvy),USA,Steven Spielberg,"Science Fiction, Thriller, Adventure",English,https://boxd.it/2bde,https://a.ltrbxd.com/resized/sm/upload/3e/48/mx/ww/war-worlds-150-1200-1200-675-675-crop-000000.jpg?v=56bda2a3b3,117,"Paramount Pictures, DreamWorks Pictures, Amblin Entertainment, Cruise/Wagner Productions","Ray Ferrier is a divorced dockworker and less-than-perfect father. Soon after his ex-wife and her new husband drop off his teenage son and young daughter for a rare weekend visit, a strange and powerful lightning storm touches down.",War of the Worlds,"Reid, Zach",2005
3.72,Christopher Reeve (Clark Kent / Superman),Margot Kidder (Lois Lane),Gene Hackman (Lex Luthor),Marlon Brando (Jor-El),Ned Beatty (Otis),UK,Richard Donner,"Action, Adventure, Science Fiction",English,https://boxd.it/27Qm,https://a.ltrbxd.com/resized/sm/upload/tk/8z/fn/pl/superman-1200-1200-675-675-crop-000000.jpg?v=baa1ed8433,144,"Dovemead Films, Alexander and Ilya Salkind Productions, International Film Production","Mild-mannered Clark Kent works as a reporter at the Daily Planet alongside his crush, Lois Lane. Clark must summon his superhero alter-ego when the nefarious Lex Luthor launches a plan to take over the world.",Superman,"Reid, Zach",1978
3.84,Christian Bale (Bruce Wayne / Batman),Michael Caine (Alfred),Liam Neeson (Ducard),Katie Holmes (Rachel Dawes),Gary Oldman (Jim Gordon),UK,Christopher Nolan,"Crime, Action, Drama",English,https://boxd.it/2aIg,https://a.ltrbxd.com/resized/sm/upload/08/e5/aa/ws/batman-begins-30-1200-1200-675-675-crop-000000.jpg?v=2d07a1ac53,140,"Warner Bros. Pictures, DC, Syncopy, Legendary Pictures, Patalex III Productions Limited","Driven by tragedy, billionaire Bruce Wayne dedicates his life to uncovering and defeating the corruption that plagues his home, Gotham City. Unable to work within the system, he instead creates a new identity, a symbol of fear for the criminal underworld - The Batman.",Batman Begins,"Reid, Zach",2005
3.77,Fionn Whitehead (Tommy),Tom Hardy (Farrier),Mark Rylance (Mr. Dawson),Kenneth Branagh (Commander Bolton),Cillian Murphy (Shivering Soldier),UK,Christopher Nolan,"Action, Drama, War",English,https://boxd.it/d0Y6,https://a.ltrbxd.com/resized/sm/upload/l9/2l/7p/rz/dunkirk-2017-1200-1200-675-675-crop-000000.jpg?v=53e6d125e1,107,"Warner Bros. Pictures, Syncopy, Dombey Street Productions","The story of the miraculous evacuation of Allied soldiers from Belgium, Britain, Canada and France, who were cut off and surrounded by the German army from the beaches and harbour of Dunkirk between May 26th and June 4th 1940 during World War II.",Dunkirk,"Reid, Zach",2017
3.81,Christian Bale (Bruce Wayne),Gary Oldman (Commissioner Gordon),Tom Hardy (Bane),Joseph Gordon-Levitt (Blake),Anne Hathaway (Selina),UK,Christopher Nolan,"Thriller, Crime, Drama, Action",English,https://boxd.it/H3m,https://a.ltrbxd.com/resized/sm/upload/am/k2/f0/ij/dark-knight-rises-1200-1200-675-675-crop-000000.jpg?v=8b93dcd6f0,165,"Syncopy, Legendary Pictures, Warner Bros. Pictures, DC","Following the death of District Attorney Harvey Dent, Batman assumes responsibility for Dent's crimes to protect the late attorney's reputation and is subsequently hunted by the Gotham City Police Department. Eight years later, Batman encounters the mysterious Selina Kyle and the villainous Bane, a new terrorist leader who overwhelms Gotham's finest. The Dark Knight resurfaces to protect a city that has branded him an enemy.",The Dark Knight Rises,"Reid, Zach",2012
3.92,Jack Black (Po (voice)),Dustin Hoffman (Master Shifu (voice)),Angelina Jolie (Tigress (voice)),Ian McShane (Tai Lung (voice)),Seth Rogen (Mantis (voice)),USA,"Mark Osborne, John Stevenson","Comedy, Family, Animation, Action",English,https://boxd.it/1Yws,https://a.ltrbxd.com/resized/sm/upload/q8/hk/5s/lu/kung-fu-panda-110-1200-1200-675-675-crop-000000.jpg?v=8d62e7df56,90,DreamWorks Animation,"Chosen by prophecy but doubted by all, Po is an unlikely choice for the mystical title of the Dragon Warrior—a clumsy panda thrust into the world of kung fu as a deadly enemy threatens the Valley of Peace. Under reluctant guidance by Master Shifu and the Furious Five, Po must embrace who he is to unlock the power that no scroll can teach.",Kung Fu Panda,"Reid, Zach",2008
3.20,Andrew Garfield (Spider-Man / Peter Parker),Emma Stone (Gwen Stacy),Jamie Foxx (Electro / Max Dillon),Dane DeHaan (Green Goblin / Harry Osborn),Colm Feore (Donald Menken),USA,Marc Webb,"Science Fiction, Action, Adventure",English,https://boxd.it/3utM,https://a.ltrbxd.com/resized/sm/upload/8g/vh/5j/hp/the-amazing-spider-man-2-1200-1200-675-675-crop-000000.jpg?v=365c496a70,141,"Columbia Pictures, Matt Tolmach Productions, Arad Productions, Marvel Entertainment","For Peter Parker, life is busy. Between taking out the bad guys as Spider-Man and spending time with the person he loves, Gwen Stacy, high school graduation cannot come quickly enough. Peter has not forgotten about the promise he made to Gwen’s father to protect her by staying away, but that is a promise he cannot keep. Things will change for Peter when a new villain, Electro, emerges, an old friend, Harry Osborn, returns, and Peter uncovers new clues about his past.",The Amazing Spider-Man 2,"Reid, Zach",2014
3.61,Ben Stiller (Alex (voice)),Chris Rock (Marty (voice)),David Schwimmer (Melman (voice)),Jada Pinkett Smith (Gloria (voice)),Sacha Baron Cohen (King Julien (voice)),USA,"Eric Darnell, Tom McGrath","Family, Comedy, Animation, Adventure",English,https://boxd.it/29dc,https://a.ltrbxd.com/resized/sm/upload/5s/9u/c1/pv/madagascar-1200-1200-675-675-crop-000000.jpg?v=ab79d7685c,86,"Pacific Data Images, DreamWorks Animation",Four animal friends get a taste of the wild life when they break out of captivity at the Central Park Zoo and wash ashore on the island of Madagascar.,Madagascar,"Reid, Zach",2005
3.76,Will Ferrell (Megamind (voice)),Brad Pitt (Metro Man (voice)),Tina Fey (Roxanne Ritchi (voice)),Jonah Hill (Tighten (voice)),David Cross (Minion (voice)),USA,Tom McGrath,"Comedy, Science Fiction, Action, Family, Animation",English,https://boxd.it/16Sk,https://a.ltrbxd.com/resized/sm/upload/mg/7i/be/rb/megamind-150-1200-1200-675-675-crop-000000.jpg?v=aa8c827f40,96,"DreamWorks Animation, Pacific Data Images","After Megamind, a highly intelligent alien supervillain, defeats his long-time nemesis Metro Man, Megamind creates a new hero to fight, but must act to save the city when his ""creation"" becomes an even worse villain than he was.",Megamind,"Reid, Zach",2010
3.61,Johnny Depp (Jack Sparrow),Geoffrey Rush (Barbossa),Orlando Bloom (Will Turner),Keira Knightley (Elizabeth Swann),Jack Davenport (Norrington),USA,Gore Verbinski,"Adventure, Action, Fantasy",English,https://boxd.it/2aGu,https://a.ltrbxd.com/resized/sm/upload/er/ay/4v/hh/pirates-at-worlds-end-80-1200-1200-675-675-crop-000000.jpg?v=20ddbd6d9f,169,"Jerry Bruckheimer Films, Second Mate Productions, Walt Disney Pictures","After losing Captain Jack Sparrow to the locker of Davy Jones, Will Turner, Elizabeth Swann, and Captain Barbossa journey to the ends of the earth to rescue him. And as the East India Trading Company tightens its grip on the seas under Lord Cutler Beckett—now in control of Davy Jones—the fate of piracy hangs by a thread. Now, they must unite the pirate lords for one final stand. But as loyalties are tested and alliances shift, each must ultimately choose where they stand in the battle for freedom on the high seas.",Pirates of the Caribbean: At World's End,"Reid, Zach",2007
3.05,Henry Cavill (Clark Kent / Superman / Kal-El),Amy Adams (Lois Lane),Russell Crowe (Jor-El),Michael Shannon (General Zod),Kevin Costner (Jonathan Kent),UK,Zack Snyder,"Action, Adventure, Science Fiction",English,https://boxd.it/FRk,https://a.ltrbxd.com/resized/sm/upload/ca/j6/xk/6f/man-of-steel-1200-1200-675-675-crop-000000.jpg?v=28e9a32f62,143,"Syncopy, Peters Entertainment, Warner Bros. Pictures, DC","A young boy learns that he has extraordinary powers and is not of this earth. As a young man, he journeys to discover where he came from and what he was sent here to do. But the hero in him must emerge if he is to save the world from annihilation and become the symbol of hope for all mankind.",Man of Steel,"Reid, Zach",2013
2.47,Ben Affleck (Bruce Wayne / Batman),Henry Cavill (Clark Kent / Superman),Jesse Eisenberg (Lex Luthor),Gal Gadot (Diana Prince / Wonder Woman),Amy Adams (Lois),USA,Zack Snyder,"Action, Fantasy, Adventure",English,https://boxd.it/6fBW,https://a.ltrbxd.com/resized/sm/upload/ua/mn/pb/t9/batman-v-superman-dawn-of-justice-1200-1200-675-675-crop-000000.jpg?v=83114a32b5,152,"Warner Bros. Pictures, RatPac Entertainment, Atlas Entertainment, Cruel & Unusual Films, DC","Fearing the actions of a god-like Super Hero left unchecked, Gotham City’s own formidable, forceful vigilante takes on Metropolis’s most revered, modern-day savior, while the world wrestles with what sort of hero it really needs. And with Batman and Superman at war with one another, a new threat quickly arises, putting mankind in greater danger than it’s ever known before.",Batman v Superman: Dawn of Justice,"Reid, Zach",2016
3.77,Jack Black (Po (voice)),Angelina Jolie (Tigress (voice)),Dustin Hoffman (Master Shifu (voice)),Gary Oldman (Lord Shen (voice)),Jackie Chan (Monkey (voice)),USA,Jennifer Yuh Nelson,"Family, Action, Animation, Comedy",English,https://boxd.it/G36,https://a.ltrbxd.com/resized/sm/upload/9a/wr/9r/8f/kung-fu-panda-2-50-1200-1200-675-675-crop-000000.jpg?v=bc1be2dc26,91,DreamWorks Animation,"Po is finally living the dream as the Dragon Warrior—until a shadow from his past comes roaring back. When the ruthless peacock Lord Shen unleashes a devastating new weapon used to wipe out kung fu masters across the land, Po and the Furious Five race across China to put an end to his plans. But if Po is to have any hope of stopping him, he must first confront the truth of his origins—and find inner peace before his past tears him apart.",Kung Fu Panda 2,"Reid, Zach",2011
2.96,Johnny Depp (Jack Sparrow),Penélope Cruz (Angelica),Geoffrey Rush (Hector Barbossa),"Ian McShane (Edward ""Blackbeard"" Teach)",Kevin McNally (Joshamee Gibbs),UK,Rob Marshall,"Adventure, Fantasy, Action",English,https://boxd.it/27Z4,https://a.ltrbxd.com/resized/sm/upload/0y/yj/79/0k/pirates-on-stranger-tides-40-1200-1200-675-675-crop-000000.jpg?v=b839f295f0,136,"Walt Disney Pictures, Jerry Bruckheimer Films, Moving Picture Company","When Jack crosses paths with a woman from his past, he's not sure if it's love...or if she's a ruthless con artist using him to find the fabled Fountain of Youth.",Pirates of the Caribbean: On Stranger Tides,"Reid, Zach",2011
3.49,Robert Downey Jr. (Sherlock Holmes),Jude Law (Dr. John Watson),Rachel McAdams (Irene Adler),Mark Strong (Lord Henry Blackwood),Eddie Marsan (Inspector Lestrade),USA,Guy Ritchie,"Mystery, Adventure, Crime",English,https://boxd.it/1W2A,https://a.ltrbxd.com/resized/sm/upload/u9/e3/2j/24/sherlock-holmes-80-1200-1200-675-675-crop-000000.jpg?v=e70b4ff396,129,"Warner Bros. Pictures, Village Roadshow Pictures, Silver Pictures, Wigram Productions",Eccentric consulting detective Sherlock Holmes and Doctor John Watson battle to bring down a new nemesis and unravel a deadly plot that could destroy England.,Sherlock Holmes,"Reid, Zach",2009
2.89,Chiwetel Ejiofor (Scar (voice)),John Oliver (Zazu (voice)),Donald Glover (Simba (voice)),James Earl Jones (Mufasa (voice)),John Kani (Rafiki (voice)),USA,Jon Favreau,"Family, Adventure, Drama, Animation",English,https://boxd.it/eSjI,https://a.ltrbxd.com/resized/sm/upload/57/7g/9e/v0/the-lion-king-2019-1200-1200-675-675-crop-000000.jpg?v=241a0f0bfe,118,"Walt Disney Pictures, Fairview Entertainment","Simba idolizes his father, King Mufasa, and takes to heart his own royal destiny. But not everyone in the kingdom celebrates the new cub's arrival. Scar, Mufasa's brother—and former heir to the throne—has plans of his own. The battle for Pride Rock is ravaged with betrayal, tragedy and drama, ultimately resulting in Simba's exile. With help from a curious pair of newfound friends, Simba will have to figure out how to grow up and take back what is rightfully his.",The Lion King,"Reid, Zach",2019
3.04,Will Smith (Oscar (voice)),Robert De Niro (Don Lino (voice)),Renée Zellweger (Angie (voice)),Jack Black (Lenny (voice)),Angelina Jolie (Lola (voice)),USA,"Bibo Bergeron, Rob Letterman et al","Animation, Action, Comedy, Family",English,https://boxd.it/1VYe,https://a.ltrbxd.com/resized/sm/upload/es/jj/xa/dh/shark-tale-1200-1200-675-675-crop-000000.jpg?v=bf3494a679,90,DreamWorks Animation,"Oscar is a small fish whose big aspirations often get him into trouble. Meanwhile, Lenny is a great white shark with a surprising secret that no sea creature would guess: He's a vegetarian. When a lie turns Oscar into an improbable hero and Lenny becomes an outcast, the two form an unlikely friendship.",Shark Tale,"Reid, Zach",2004
3.30,Jack Black (Po (voice)),Bryan Cranston (Li (voice)),Dustin Hoffman (Shifu (voice)),Angelina Jolie (Tigress (voice)),J.K. Simmons (Kai (voice)),China,"Jennifer Yuh Nelson, Alessandro Carloni","Adventure, Comedy, Action, Family, Animation",English,https://boxd.it/4uRQ,https://a.ltrbxd.com/resized/sm/upload/2f/24/zk/76/kung-fu-panda-3-1200-1200-675-675-crop-000000.jpg?v=dd4af7666e,95,"DreamWorks Animation, Oriental DreamWorks, Zhong Ming You Ying Film, China Film Group Corporation 中国电影集团 (CFGC)","While Po and his father are visiting a secret panda village, an evil spirit threatens all of China, forcing Po to form a ragtag army to fight back.",Kung Fu Panda 3,"Reid, Zach",2016
3.27,Ben Stiller (Alex (voice)),Chris Rock (Marty / Additional Zebras (voice)),David Schwimmer (Melman (voice)),Jada Pinkett Smith (Gloria (voice)),Sacha Baron Cohen (Julien (voice)),USA,"Eric Darnell, Tom McGrath","Animation, Family, Comedy, Adventure",English,https://boxd.it/1W2K,https://a.ltrbxd.com/resized/sm/upload/g4/l1/jr/54/madagascar-2-1200-1200-675-675-crop-000000.jpg?v=6ac6c7a43f,89,"DreamWorks Animation, Pacific Data Images","Alex, Marty, and other zoo animals find a way to escape from Madagascar when the penguins reassemble a wrecked airplane. The precariously repaired craft stays airborne just long enough to make it to the African continent. There the New Yorkers encounter members of their own species for the first time. Africa proves to be a wild place, but Alex and company wonder if it is better than their Central Park home.",Madagascar: Escape 2 Africa,"Reid, Zach",2008
3.14,Ben Stiller (Alex (voice)),Chris Rock (Marty (voice)),David Schwimmer (Melman (voice)),Jada Pinkett Smith (Gloria (voice)),Frances McDormand (Captain Chantel DuBois (voice)),USA,"Eric Darnell, Tom McGrath et al","Comedy, Family, Adventure, Animation",English,https://boxd.it/2NF6,https://a.ltrbxd.com/resized/sm/upload/om/8z/fg/zp/madagascar-3-europes-most-wanted-1200-1200-675-675-crop-000000.jpg?v=c072ac9d17,93,"DreamWorks Animation, Pacific Data Images","Animal pals Alex, Marty, Melman, and Gloria are still trying to make it back to New York's Central Park Zoo. They are forced to take a detour to Europe to find the penguins and chimps who broke the bank at a Monte Carlo casino. When French animal-control officer Capitaine Chantel DuBois picks up their scent, Alex and company are forced to hide out in a traveling circus.",Madagascar 3: Europe's Most Wanted,"Reid, Zach",2012
3.37,Robert Downey Jr. (Sherlock Holmes),Jude Law (Dr. John Watson),Noomi Rapace (Madam Simza Heron),Jared Harris (Professor James Moriarty),Rachel McAdams (Irene Adler),USA,Guy Ritchie,"Mystery, Adventure, Crime",English,https://boxd.it/k3S,https://a.ltrbxd.com/resized/sm/upload/v3/g3/ly/ql/sherlock-holmes-a-game-of-shadows-1200-1200-675-675-crop-000000.jpg?v=7e09cba280,129,"Village Roadshow Pictures, Silver Pictures, Wigram Productions, Lin Pictures","There is a new criminal mastermind at large (Professor Moriarty) and not only is he Holmes’ intellectual equal, but his capacity for evil and lack of conscience may give him an advantage over the detective.",Sherlock Holmes: A Game of Shadows,"Reid, Zach",2011
2.62,Alec Baldwin (Theodore Templeton (voice)),Steve Buscemi (Francis E. Francis (voice)),Miles Bakshi (Tim Templeton (voice)),Jimmy Kimmel (Ted Templeton (voice)),Lisa Kudrow (Janice Templeton (voice)),USA,Tom McGrath,"Animation, Comedy, Family",English,https://boxd.it/9mfO,https://a.ltrbxd.com/resized/sm/upload/yt/4e/ok/tw/the-boss-baby-1200-1200-675-675-crop-000000.jpg?v=169e5f6c79,97,DreamWorks Animation,"A story about how a new baby's arrival impacts a family, told from the point of view of a delightfully unreliable narrator, a wildly imaginative 7 year old named Tim.",The Boss Baby,"Reid, Zach",2017
3.84,Keanu Reeves (John Wick),Michael Nyqvist (Viggo Tarasov),Alfie Allen (Iosef Tarasov),Willem Dafoe (Marcus),Dean Winters (Avi),USA,Chad Stahelski,"Action, Thriller",English,https://boxd.it/7dEc,https://a.ltrbxd.com/resized/sm/upload/wp/bs/m0/17/john-wick-1200-1200-675-675-crop-000000.jpg?v=a0df875fb4,101,"87Eleven, DefyNite Films, MJW Films, Thunder Road",Ex-hitman John Wick comes out of retirement to track down the gangsters that took everything from him.,John Wick,"Reid, Zach",2014
3.71,Keanu Reeves (John Wick),Common (Cassian),Laurence Fishburne (Bowery King),Riccardo Scamarcio (Santino D'Antonio),Ruby Rose (Ares),USA,Chad Stahelski,"Crime, Action, Thriller",English,https://boxd.it/ayGu,https://a.ltrbxd.com/resized/sm/upload/de/gu/a5/e4/john-wick-2-1200-1200-675-675-crop-000000.jpg?v=033ad850c4,122,"Thunder Road, 87Eleven, Summit Entertainment","John Wick is forced out of retirement by a former associate looking to seize control of a shadowy international assassins’ guild. Bound by a blood oath to aid him, Wick travels to Rome and does battle against some of the world’s most dangerous killers.",John Wick: Chapter 2,"Reid, Zach",2017
3.42,Jim Carrey (Stanley Ipkiss / The Mask),Peter Riegert (Mitch Kellaway),Peter Greene (Dorian Tyrrell),Amy Yasbeck (Peggy Brandt),Richard Jeni (Charlie Schumaker),USA,Chuck Russell,"Fantasy, Romance, Crime, Comedy",English,https://boxd.it/29rS,https://a.ltrbxd.com/resized/sm/upload/22/02/m2/oa/the-mask-1200-1200-675-675-crop-000000.jpg?v=19b69a05f4,101,"Dark Horse Entertainment, New Line Cinema","Stanley Ipkiss, an insecure banker who has lost his zest for life stumbles upon an ancient mask, that turns him into a confident suave cartoon-like character who upsets his ordinary life.",The Mask,"Reid, Zach",1994
3.27,Jim Carrey (Bruce Nolan),Morgan Freeman (God),Jennifer Aniston (Grace Connelly),Philip Baker Hall (Jack Baylor),Catherine Bell (Susan Ortega),USA,Tom Shadyac,"Comedy, Fantasy",English,https://boxd.it/2aCC,https://a.ltrbxd.com/resized/sm/upload/32/w2/0c/x8/bruce-almighty-1200-1200-675-675-crop-000000.jpg?v=68ad5fbef0,101,"Pit Bull Productions, Spyglass Entertainment, Universal Pictures, Shady Acres Entertainment","Bruce Nolan toils as a ""human interest"" television reporter in Buffalo, NY, but despite his high ratings and the love of his beautiful girlfriend, Bruce remains unfulfilled. At the end of the worst day in his life, he angrily ridicules God — and the Almighty responds, endowing Bruce with all of His divine powers.",Bruce Almighty,"Reid, Zach",2003
3.33,Jim Carrey (Fletcher Reede),Maura Tierney (Audrey Reede),Justin Cooper (Max Reede),Cary Elwes (Jerry),Anne Haney (Greta),USA,Tom Shadyac,"Comedy, Fantasy",English,https://boxd.it/28sg,https://a.ltrbxd.com/resized/sm/upload/8l/d1/9h/hk/liar-liar-1200-1200-675-675-crop-000000.jpg?v=9cbd81044f,86,"Universal Pictures, Imagine Entertainment","Forced by his son's birthday wish, fast-talking attorney and habitual liar Fletcher Reede must tell the truth for the next 24 hours.",Liar Liar,"Reid, Zach",1997
3.38,Jim Carrey (Lloyd Christmas),Jeff Daniels (Harry Dunne),Lauren Holly (Mary Swanson),Teri Garr (Helen Swanson),Charles Rocket (Nicholas Andre),USA,Peter Farrelly,Comedy,English,https://boxd.it/206m,https://a.ltrbxd.com/resized/sm/upload/ih/i4/y1/qs/dumb-dumber-1200-1200-675-675-crop-000000.jpg?v=9bb1c0ce74,107,"New Line Cinema, Motion Picture Corporation of America","Lloyd and Harry are two men whose stupidity is really indescribable. When Mary, a beautiful woman, loses an important suitcase with money before she leaves for Aspen, the two friends (who have found the suitcase) decide to return it to her. After some ""adventures"" they finally get to Aspen where, using the lost money they live it up and fight for Mary's heart.",Dumb and Dumber,"Reid, Zach",1994
3.21,Jim Carrey (Ace Ventura),Courteney Cox (Melissa Robinson),Sean Young (Lt. Lois Einhorn),Tone Loc (Emilio),Dan Marino (Dan Marino),USA,Tom Shadyac,"Crime, Comedy, Mystery",English,https://boxd.it/25RW,https://a.ltrbxd.com/resized/sm/upload/0o/gu/38/23/ace-ventura-pet-detective-1200-1200-675-675-crop-000000.jpg?v=6bd0c6a1f4,86,Morgan Creek Entertainment,"He's Ace Ventura: Pet Detective. The Ace is on the case to find the Miami Dolphins' missing mascot and quarterback Dan Marino. He goes eyeball to eyeball with a man-eating shark, stakes out the Miami Dolphins and woos and wows the ladies. Whether he's undercover, under fire or underwater, he always gets his man… or beast!",Ace Ventura: Pet Detective,"Reid, Zach",1994
3.18,Jim Carrey (Carl Allen),Zooey Deschanel (Renee Allison),Bradley Cooper (Peter),John Michael Higgins (Nick),Rhys Darby (Norman),UK,Peyton Reed,"Romance, Comedy",English,https://boxd.it/1WPW,https://a.ltrbxd.com/resized/sm/upload/7w/5r/ju/sn/yes-man-1200-1200-675-675-crop-000000.jpg?v=346712adfe,104,"Warner Bros. Pictures, Village Roadshow Pictures, Heyday Films, The Zanuck Company","Carl Allen, a guy whose life is going nowhere, signs up for a self-help program based on one simple covenant: say yes to everything…and anything.",Yes Man,"Reid, Zach",2008
