letterboxd_uri,title,year,director,average_rating,synopsis,runtime,language,country,genres,cast_1,cast_2,cast_3,cast_4,cast_5,poster_url,studio
https://boxd.it/b8wK,Blade Runner 2049,2017,Denis Villeneuve,4.10,"Thirty years after the events of the first film, a new blade runner, LAPD Officer K, unearths a long-buried secret that has the potential to plunge what's left of society into chaos. K's discovery leads him on a quest to find Rick Deckard, a former LAPD blade runner who has been missing for 30 years.",164,English,Canada,"Science Fiction, Drama",Ryan Gosling ('K'),Harrison Ford (Rick Deckard),Ana de Armas (Joi),Dave Bautista (Sapper Morton),Robin Wright (Lieutenant Joshi),https://a.ltrbxd.com/resized/sm/upload/aj/h8/ku/9n/blade-runner-2049-1200-1200-675-675-crop-000000.jpg?v=5263a1d801,"Alcon Entertainment, Columbia Pictures, Scott Free Productions, Bud Yorkin Productions, Torridon Films, 16:14 Entertainment"
https://boxd.it/2a1m,The Matrix,1999,"Lana Wachowski, Lilly Wachowski",4.18,"Set in the 22nd century, The Matrix tells the story of a computer hacker who joins a group of underground insurgents fighting the vast and powerful computers who now rule the earth.",136,English,USA,"Science Fiction, Action",Keanu Reeves (Neo),Laurence Fishburne (Morpheus),Carrie-Anne Moss (Trinity),Hugo Weaving (Agent Smith),Gloria Foster (Oracle),https://a.ltrbxd.com/resized/sm/upload/o3/er/ey/ie/matrix-1200-1200-675-675-crop-000000.jpg?v=eea86a2195,"Village Roadshow Pictures, Groucho II Film Partnership, Silver Pictures, Warner Bros. Pictures"
https://boxd.it/jhxe,Midsommar,2019,Ari Aster,3.74,"Several friends travel to Sweden to study as anthropologists a summer festival that is held every ninety years in the remote hometown of one of them. What begins as a dream vacation in a place where the sun never sets, gradually turns into a dark nightmare as the mysterious inhabitants invite them to participate in their disturbing festive activities.",147,English,Sweden,"Mystery, Drama, Horror",Florence Pugh (Dani),Jack Reynor (Christian),William Jackson Harper (Josh),Will Poulter (Mark),Vilhelm Blomgren (Pelle),https://a.ltrbxd.com/resized/sm/upload/5q/jr/xl/0r/midsommar-1200-1200-675-675-crop-000000.jpg?v=620571be01,"B-Reel Films, Square Peg"
https://boxd.it/1WRy,How to Train Your Dragon,2010,"Dean DeBlois, Chris Sanders",4.14,"As the son of a Viking leader on the cusp of manhood, shy Hiccup Horrendous Haddock III faces a rite of passage: he must kill a dragon to prove his warrior mettle. But after downing a feared dragon, he realizes that he no longer wants to destroy it, and instead befriends the beast – which he names Toothless – much to the chagrin of his warrior father.",98,English,USA,"Fantasy, Family, Adventure, Animation",Jay Baruchel (Hiccup (voice)),Gerard Butler (Stoick (voice)),Craig Ferguson (Gobber (voice)),America Ferrera (Astrid (voice)),Jonah Hill (Snotlout (voice)),https://a.ltrbxd.com/resized/sm/upload/xm/yg/qr/pw/how-to-train-10-1200-1200-675-675-crop-000000.jpg?v=302fab52e6,DreamWorks Animation
https://boxd.it/bC8e,It,2017,Andy Muschietti,3.46,"In a small town in Maine, seven children known as The Losers Club come face to face with life problems, bullies and a monster that takes the shape of a clown called Pennywise.",135,English,USA,"Drama, Thriller, Horror",Jaeden Martell (Bill Denbrough),Jeremy Ray Taylor (Ben Hanscom),Sophia Lillis (Beverly Marsh),Finn Wolfhard (Richie Tozier),Chosen Jacobs (Mike Hanlon),https://a.ltrbxd.com/resized/sm/upload/c0/c3/jy/rn/it-2017-1200-1200-675-675-crop-000000.jpg?v=df8da545a8,"New Line Cinema, Vertigo Entertainment, Lin Pictures, KatzSmith Productions"
https://boxd.it/jWEA,Knives Out,2019,Rian Johnson,3.96,"When renowned crime novelist Harlan Thrombey is found dead at his estate just after his 85th birthday, the inquisitive and debonair Detective Benoit Blanc is mysteriously enlisted to investigate. From Harlan's dysfunctional family to his devoted staff, Blanc sifts through a web of red herrings and self-serving lies to uncover the truth behind Harlan's untimely death.",131,English,USA,"Mystery, Comedy, Crime",Daniel Craig (Benoit Blanc),Chris Evans (Ransom Drysdale),Ana de Armas (Marta Cabrera),Jamie Lee Curtis (Linda Drysdale),Michael Shannon (Walt Thrombey),https://a.ltrbxd.com/resized/sm/upload/43/tv/iw/76/knives-out-1200-1200-675-675-crop-000000.jpg?v=355ba0f034,"MRC, T-Street"
https://boxd.it/bhF2,Baby Driver,2017,Edgar Wright,3.70,"After being coerced into working for a crime boss, a young getaway driver finds himself taking part in a heist doomed to fail.",113,English,UK,"Crime, Action",Ansel Elgort (Baby),Kevin Spacey (Doc),Lily James (Debora),Jon Hamm (Buddy),Jamie Foxx (Bats),https://a.ltrbxd.com/resized/sm/upload/i8/h2/et/9l/baby-driver-1200-1200-675-675-crop-000000.jpg?v=a786173318,"Big Talk Studios, Working Title Films (US), MRC"
https://boxd.it/2b9m,Gladiator,2000,Ridley Scott,4.18,"After the death of Emperor Marcus Aurelius, his devious son takes power and demotes Maximus, one of Rome's most capable generals who Marcus preferred. Eventually, Maximus is forced to become a gladiator and battle to the death against other men for the amusement of paying audiences.",155,English,UK,"Action, Adventure, Drama",Russell Crowe (Maximus),Joaquin Phoenix (Commodus),Connie Nielsen (Lucilla),Oliver Reed (Proximo),Richard Harris (Marcus Aurelius),https://a.ltrbxd.com/resized/sm/upload/mz/f2/14/6l/gladiator-1200-1200-675-675-crop-000000.jpg?v=8c7e0ad2bc,"Universal Pictures, Scott Free Productions, Red Wagon Entertainment, Mill Film, DreamWorks Pictures"
https://boxd.it/29z8,Shrek 2,2004,"Andrew Adamson, Kelly Asbury et al",4.12,"Happily ever after never seemed so far far away when a trip to meet the in-laws turns into a hilariously twisted adventure for Shrek and Fiona. With the help of his faithful Donkey, Shrek takes on a potion-brewing Fairy Godmother, the pompous Prince Charming, and the ogre-killer, Puss In Boots.",92,English,USA,"Romance, Family, Comedy, Animation, Fantasy",Mike Myers (Shrek (voice)),Eddie Murphy (Donkey (voice)),Cameron Diaz (Princess Fiona (voice)),Julie Andrews (Queen Lillian (voice)),Antonio Banderas (Puss in Boots (voice)),https://a.ltrbxd.com/resized/sm/upload/b2/i4/ji/hg/shrek-2-1200-1200-675-675-crop-000000.jpg?v=5cbec1e1bc,"DreamWorks Animation, Pacific Data Images"
https://boxd.it/2b5E,The Lord of the Rings: The Two Towers,2002,Peter Jackson,4.43,"Frodo Baggins and the other members of the Fellowship continue on their sacred quest to destroy the One Ring--but on separate paths. Their destinies lie at two towers--Orthanc Tower in Isengard, where the corrupt wizard Saruman awaits, and Sauron's fortress at Barad-dur, deep within the dark lands of Mordor. Frodo and Sam are trekking to Mordor to destroy the One Ring of Power while Gimli, Legolas and Aragorn search for the orc-captured Merry and Pippin. All along, nefarious wizard Saruman awaits the Fellowship members at the Orthanc Tower in Isengard.",179,English,New Zealand,"Action, Fantasy, Adventure",Elijah Wood (Frodo),Ian McKellen (Gandalf),Viggo Mortensen (Aragorn),Sean Astin (Sam),Andy Serkis (Gollum),https://a.ltrbxd.com/resized/sm/upload/l5/j6/zw/ib/lotr-the-two-towers-1200-1200-675-675-crop-000000.jpg?v=c3ae1188ea,"New Line Cinema, WingNut Films, The Saul Zaentz Company"
https://boxd.it/28Vs,American Psycho,2000,Mary Harron,3.77,"A wealthy New York investment banking executive hides his alternate psychopathic ego from his co-workers and friends as he escalates deeper into his illogical, gratuitous fantasies.",102,English,Canada,"Crime, Drama, Thriller, Horror",Christian Bale (Patrick Bateman),Justin Theroux (Timothy Bryce),Josh Lucas (Craig McDermott),Bill Sage (David Van Patten),Chloë Sevigny (Jean),https://a.ltrbxd.com/resized/sm/upload/tr/kl/dj/zi/american-psycho-1200-1200-675-675-crop-000000.jpg?v=59e7d630d5,"Lionsgate, Pressman Film, Muse Productions, Christian Halsey Solomon Productions"
https://boxd.it/2DjO,Mad Max: Fury Road,2015,George Miller,4.16,"An apocalyptic story set in the furthest reaches of our planet, in a stark desert landscape where humanity is broken, and most everyone is crazed fighting for the necessities of life. Within this world exist two rebels on the run who just might be able to restore order.",121,English,Australia,"Science Fiction, Adventure, Action",Tom Hardy (Max Rockatansky),Charlize Theron (Imperator Furiosa),Nicholas Hoult (Nux),Hugh Keays-Byrne (Immortan Joe),Josh Helman (Slit),https://a.ltrbxd.com/resized/sm/upload/50/tw/wa/80/mad-max-fury-road-1200-1200-675-675-crop-000000.jpg?v=1a543f4e46,"Warner Bros. Pictures, Village Roadshow Pictures, Kennedy Miller Mitchell, RatPac Entertainment"
https://boxd.it/eOCm,Get Out,2017,Jordan Peele,4.13,"Chris and his girlfriend Rose go upstate to visit her parents for the weekend. At first, Chris reads the family's overly accommodating behavior as nervous attempts to deal with their daughter's interracial relationship, but as the weekend progresses, a series of increasingly disturbing discoveries lead him to a truth that he never could have imagined.",104,English,USA,"Horror, Mystery, Thriller",Daniel Kaluuya (Chris Washington),Allison Williams (Rose Armitage),Catherine Keener (Missy Armitage),Bradley Whitford (Dean Armitage),Caleb Landry Jones (Jeremy Armitage),https://a.ltrbxd.com/resized/sm/upload/n1/db/zy/ha/get-out-160-1200-1200-675-675-crop-000000.jpg?v=4686a15e0a,"Monkeypaw Productions, Blumhouse Productions, QC Entertainment"
https://boxd.it/9vE4,Avengers: Endgame,2019,"Anthony Russo, Joe Russo",3.97,"After the devastating events of Avengers: Infinity War, the universe is in ruins due to the efforts of the Mad Titan, Thanos. With the help of remaining allies, the Avengers must assemble once more in order to undo Thanos' actions and restore order to the universe once and for all, no matter what consequences may be in store.",181,English,USA,"Science Fiction, Action, Adventure",Robert Downey Jr. (Tony Stark / Iron Man),Chris Evans (Steve Rogers / Captain America),Mark Ruffalo (Bruce Banner / Hulk),Chris Hemsworth (Thor),Scarlett Johansson (Natasha Romanoff / Black Widow),https://a.ltrbxd.com/resized/sm/upload/pv/3f/zz/og/avengers-endgame-1200-1200-675-675-crop-000000.jpg?v=55fc50f8fa,Marvel Studios
https://boxd.it/2uds,The Hunger Games,2012,Gary Ross,3.81,"In a dystopian society where the Capitol forces each district to send two young tributes to fight to the death in a televised spectacle, a girl volunteers to take her sister’s place, setting the stage for a struggle of survival and defiance.",142,English,USA,"Action, Science Fiction, Thriller, Adventure",Jennifer Lawrence (Katniss Everdeen),Josh Hutcherson (Peeta Mellark),Liam Hemsworth (Gale Hawthorne),Woody Harrelson (Haymitch Abernathy),Elizabeth Banks (Effie Trinket),https://a.ltrbxd.com/resized/sm/upload/z0/te/xv/y3/the-hunger-games-1200-1200-675-675-crop-000000.jpg?v=32b6960277,"Lionsgate, Color Force"
https://boxd.it/17ue,The Social Network,2010,David Fincher,3.93,"In 2003, Harvard undergrad and computer programmer Mark Zuckerberg begins work on a new concept that eventually turns into the global social network known as Facebook. Six years later, Mark is one of the youngest billionaires ever, but his unprecedented success leads to both personal and legal complications when he ends up on the receiving end of two lawsuits, one involving his former friend.",121,English,USA,Drama,Jesse Eisenberg (Mark Zuckerberg),Andrew Garfield (Eduardo Saverin),Armie Hammer (Cameron Winklevoss / Tyler Winklevoss),Justin Timberlake (Sean Parker),Rooney Mara (Erica Albright),https://a.ltrbxd.com/resized/sm/upload/dr/ty/49/rl/the-social-network-2010-1200-1200-675-675-crop-000000.jpg?v=cbacd98bfa,"Columbia Pictures, Relativity Media, Scott Rudin Productions, Michael De Luca Productions, Trigger Street Productions"
https://boxd.it/2bcK,Memento,2000,Christopher Nolan,4.18,"Leonard Shelby is tracking down the man who raped and murdered his wife. The difficulty of locating his wife's killer, however, is compounded by the fact that he suffers from a rare, untreatable form of short-term memory loss. Although he can recall details of life before his accident, Leonard cannot remember what happened fifteen minutes ago, where he's going, or why.",113,English,USA,"Thriller, Mystery",Guy Pearce (Leonard),Carrie-Anne Moss (Natalie),Joe Pantoliano (Teddy),Mark Boone Junior (Burt),Russ Fega (Waiter),https://a.ltrbxd.com/resized/sm/upload/za/7s/m0/sh/memento-1200-1200-675-675-crop-000000.jpg?v=d37b27369d,"Newmarket Films, Summit Entertainment, Team Todd, I Remember Productions"
https://boxd.it/1YPY,Ferris Bueller's Day Off,1986,John Hughes,3.96,"After high school slacker Ferris Bueller successfully fakes an illness in order to skip school for the day, he goes on a series of adventures throughout Chicago with his girlfriend Sloane and best friend Cameron, all the while trying to outwit his wily school principal and fed-up sister.",103,English,USA,Comedy,Matthew Broderick (Ferris Bueller),Alan Ruck (Cameron Frye),Mia Sara (Sloane Peterson),Jeffrey Jones (Ed Rooney),Jennifer Grey (Jeanie Bueller),https://a.ltrbxd.com/resized/sm/upload/ee/2s/51/cz/ferris-buellers-day-off-1200-1200-675-675-crop-000000.jpg?v=7177f26dd0,"Paramount Pictures, Hughes Entertainment"
https://boxd.it/1MLK,The Sound of Music,1965,Robert Wise,4.25,"In the years before World War II, a tomboyish postulant at an Austrian abbey is hired as a governess in the home of a widowed naval captain with seven children and brings a new love of life and music into the home.",174,English,USA,"Drama, Music, Romance, Family",Julie Andrews (Maria),Christopher Plummer (Captain Georg von Trapp),Eleanor Parker (The Baroness),Charmian Carr (Liesl von Trapp),Nicholas Hammond (Friedrich von Trapp),https://a.ltrbxd.com/resized/sm/upload/vo/2i/gw/0h/the-sound-of-music-1200-1200-675-675-crop-000000.jpg?v=8b693c87cb,"Robert Wise Productions, Argyle Enterprises, 20th Century Fox"
https://boxd.it/29ho,Cars,2006,John Lasseter,3.91,"Lightning McQueen, a hotshot rookie race car driven to succeed, discovers that life is about the journey, not the finish line, when he finds himself unexpectedly detoured in the sleepy Route 66 town of Radiator Springs. On route across the country to the big Piston Cup Championship in California to compete against two seasoned pros, McQueen gets to know the town's offbeat characters.",117,English,USA,"Adventure, Comedy, Animation, Family",Owen Wilson (Lightning McQueen (voice)),Paul Newman (Doc Hudson (voice)),Bonnie Hunt (Sally Carrera (voice)),Larry the Cable Guy (Mater (voice)),Cheech Marin (Ramone (voice)),https://a.ltrbxd.com/resized/sm/upload/it/25/j1/wu/cars-120-1200-1200-675-675-crop-000000.jpg?v=99af96b3d6,Pixar
https://boxd.it/20hO,Superbad,2007,Greg Mottola,3.88,Two co-dependent high school seniors are forced to deal with separation anxiety after their plan to stage a booze-soaked party goes awry.,113,English,USA,Comedy,Jonah Hill (Seth),Michael Cera (Evan),Christopher Mintz-Plasse (Fogell),Bill Hader (Officer Slater),Seth Rogen (Officer Michaels),https://a.ltrbxd.com/resized/sm/upload/ba/l2/7b/a5/superbad-1200-1200-675-675-crop-000000.jpg?v=1bfdfde52a,"Columbia Pictures, Apatow Productions"
https://boxd.it/1VEo,WALL·E,2008,Andrew Stanton,4.24,"After hundreds of years doing what he was built for, WALL•E— a robot designed to clean up the earth—discovers a new purpose in life when he meets a sleek search robot named EVE. EVE comes to realize that WALL•E has inadvertently stumbled upon the key to the planet's future, and races back to space to report to the humans. Meanwhile, WALL•E chases EVE across the galaxy and sets into motion one of the most imaginative adventures ever brought to the big screen.",98,English,USA,"Animation, Science Fiction, Family",Ben Burtt (WALL·E / M-O (voice)),Elissa Knight (EVE (voice)),Jeff Garlin (Captain (voice)),"Fred Willard (Shelby Forthright, BnL CEO)",John Ratzenberger (John (voice)),https://a.ltrbxd.com/resized/sm/upload/tb/h9/tt/v5/walle-1200-1200-675-675-crop-000000.jpg?v=3de34e9aa3,Pixar
https://boxd.it/3OsE,Pitch Perfect,2012,Jason Moore,3.62,"College student Beca knows she does not want to be part of a clique, but that's exactly where she finds herself after arriving at her new school. Thrust in among mean gals, nice gals and just plain weird gals, Beca finds that the only thing they have in common is how well they sing together. She takes the women of the group out of their comfort zone of traditional arrangements and into a world of amazing harmonic combinations in a fight to the top of college music competitions.",112,English,USA,"Music, Comedy, Romance",Anna Kendrick (Beca Mitchell),Anna Camp (Aubrey Posen),Brittany Snow (Chloe Beale),Skylar Astin (Jesse Swanson),Rebel Wilson (Fat Amy),https://a.ltrbxd.com/resized/sm/upload/gs/a1/be/e1/pitch-perfect-1200-1200-675-675-crop-000000.jpg?v=a86b3c829d,"Brownstone Productions, Gold Circle Films, Universal Pictures"
https://boxd.it/E9IU,Superman,2025,James Gunn,3.83,"Superman, a journalist in Metropolis, embarks on a journey to reconcile his Kryptonian heritage with his human upbringing as Clark Kent.",130,English,USA,"Science Fiction, Adventure, Action",David Corenswet (Superman),Rachel Brosnahan (Lois Lane),Nicholas Hoult (Lex Luthor),Edi Gathegi (Mr. Terrific),Nathan Fillion (Guy Gardner),https://a.ltrbxd.com/resized/alternative-backdrop/9/5/7/0/5/0/tmdb/eGX66zonvc4bXg3rM08RUxdYSDx-1200-1200-675-675-crop-000000.jpg?v=dc1a5219f9,"Troll Court Entertainment, The Safran Company, DC Studios, Domain Entertainment"
https://boxd.it/e8ME,Wicked,2024,Jon M. Chu,3.77,"In the land of Oz, ostracized and misunderstood green-skinned Elphaba is forced to share a room with the popular aristocrat Glinda at Shiz University, and the two's unlikely friendship is tested as they begin to fulfill their respective destinies as Glinda the Good and the Wicked Witch of the West.",162,English,USA,"Romance, Drama, Fantasy",Cynthia Erivo (Elphaba),Ariana Grande (Galinda / Glinda),Michelle Yeoh (Madame Morrible),Jonathan Bailey (Fiyero),Ethan Slater (Boq),https://a.ltrbxd.com/resized/sm/upload/92/uz/fp/eq/uKb22E0nlzr914bA9KyA5CVCOlV-1200-1200-675-675-crop-000000.jpg?v=fd8fe12586,"Universal Pictures, Marc Platt Productions"
https://boxd.it/2aZc,Edward Scissorhands,1990,Tim Burton,3.90,A small suburban town receives a visit from a castaway unfinished science experiment named Edward.,105,English,USA,"Fantasy, Drama, Romance",Johnny Depp (Edward Scissorhands),Winona Ryder (Kim),Dianne Wiest (Peg),Anthony Michael Hall (Jim),Kathy Baker (Joyce),https://a.ltrbxd.com/resized/sm/upload/1i/t3/i8/lj/edward-scissorhands-1200-1200-675-675-crop-000000.jpg?v=5fb90c87db,"20th Century Fox, Tim Burton Productions"
https://boxd.it/2ape,"The Good, the Bad and the Ugly",1966,Sergio Leone,4.51,"While the Civil War rages on between the Union and the Confederacy, three men – a quiet loner, a ruthless hitman, and a Mexican bandit – comb the American Southwest in search of a strongbox containing $200,000 in stolen gold.",161,Italian,USA,Western,Clint Eastwood (Blondie),Eli Wallach (Tuco Ramirez),Lee Van Cleef (Sentenza / Angel Eyes),Aldo Giuffrè (Alcoholic Union Captain),Luigi Pistilli (Father Pablo Ramirez),https://a.ltrbxd.com/resized/sm/upload/07/zz/2k/vy/the-good-the-bad-and-the-ugly-1200-1200-675-675-crop-000000.jpg?v=6fdc9111b0,"United Artists, PEA, Arturo González PC, Constantin Film"
https://boxd.it/27q4,The Breakfast Club,1985,John Hughes,3.76,"Five high school students from different walks of life endure a Saturday detention under a power-hungry principal. The disparate group includes rebel John, princess Claire, outcast Allison, brainy Brian and Andrew, the jock. Each has a chance to tell his or her story, making the others see them a little differently -- and when the day ends, they question whether school will ever be the same.",98,English,USA,"Drama, Comedy",Emilio Estevez (Andrew Clark),Judd Nelson (John Bender),Molly Ringwald (Claire Standish),Anthony Michael Hall (Brian Johnson),Ally Sheedy (Allison Reynolds),https://a.ltrbxd.com/resized/sm/upload/6y/th/32/zi/breakfast-club-1200-1200-675-675-crop-000000.jpg?v=559613e82c,"Universal Pictures, A&M Films, Channel Productions"
https://boxd.it/9vEe,Avengers: Infinity War,2018,"Anthony Russo, Joe Russo",4.04,"As the Avengers and their allies have continued to protect the world from threats too large for any one hero to handle, a new danger has emerged from the cosmic shadows: Thanos. A despot of intergalactic infamy, his goal is to collect all six Infinity Stones, artifacts of unimaginable power, and use them to inflict his twisted will on all of reality. Everything the Avengers have fought for has led up to this moment - the fate of Earth and existence itself has never been more uncertain.",149,English,USA,"Action, Science Fiction, Adventure",Robert Downey Jr. (Tony Stark / Iron Man),Chris Evans (Steve Rogers / Captain America),Chris Hemsworth (Thor),Josh Brolin (Thanos),Mark Ruffalo (Bruce Banner / Hulk),https://a.ltrbxd.com/resized/sm/upload/22/q6/od/p6/avengers-infinity-war-1200-1200-675-675-crop-000000.jpg?v=1a4e940b9d,Marvel Studios
https://boxd.it/fA7G,Dune,2021,Denis Villeneuve,3.89,"Paul Atreides, a brilliant and gifted young man born into a great destiny beyond his understanding, must travel to the most dangerous planet in the universe to ensure the future of his family and his people. As malevolent forces explode into conflict over the planet's exclusive supply of the most precious resource in existence-a commodity capable of unlocking humanity's greatest potential-only those who can conquer their fear will survive.",155,English,USA,"Science Fiction, Adventure",Timothée Chalamet (Paul Atreides),Rebecca Ferguson (Lady Jessica Atreides),Oscar Isaac (Duke Leto Atreides),Jason Momoa (Duncan Idaho),Stellan Skarsgård (Baron Vladimir Harkonnen),https://a.ltrbxd.com/resized/sm/upload/a6/8b/5j/zk/dune-2021a-1200-1200-675-675-crop-000000.jpg?v=7422445327,Legendary Pictures
https://boxd.it/1YzQ,The Nightmare Before Christmas,1993,Henry Selick,3.97,"Tired of scaring humans every October 31 with the same old bag of tricks, Jack Skellington, the spindly king of Halloween Town, kidnaps Santa Claus and plans to deliver shrunken heads and other ghoulish gifts to children on Christmas morning. But as Christmas approaches, Jack's rag-doll girlfriend, Sally, tries to foil his misguided plans.",76,English,USA,"Family, Animation, Fantasy",Danny Elfman (Jack Skellington (singing) / Barrel / Clown with the Tear away Face (voice)),Chris Sarandon (Jack Skellington (voice)),Catherine O'Hara (Sally / Shock (voice)),William Hickey (Dr. Finkelstein (voice)),Glenn Shadix (Mayor (voice)),https://a.ltrbxd.com/resized/sm/upload/ng/yt/5d/34/nightmare-before-christmas-1200-1200-675-675-crop-000000.jpg?v=50c6eea4ee,"Touchstone Pictures, Skellington Productions"
https://boxd.it/5YPM,The Maze Runner,2014,Wes Ball,3.54,"A teenager with no memory of his past finds himself among a group of boys living in a walled enclosure surrounded by a massive, ever-changing maze. As he struggles to adapt to their rules and society, he begins to uncover clues that may lead to escape and the truth behind their confinement.",113,English,USA,"Science Fiction, Thriller, Action, Mystery",Dylan O'Brien (Thomas),Kaya Scodelario (Teresa Agnes),Thomas Brodie-Sangster (Newt),Ki Hong Lee (Minho),Will Poulter (Gally),https://a.ltrbxd.com/resized/sm/upload/yl/oy/c0/7b/the-maze-runner-1200-1200-675-675-crop-000000.jpg?v=3ddda44922,"Ingenious Media, The Gotham Group, Dayday Films, Temple Hill Entertainment, TSG Entertainment, 20th Century Fox"
https://boxd.it/icFU,The Lighthouse,2019,Robert Eggers,4.00,Two lighthouse keepers try to maintain their sanity while living on a remote and mysterious New England island in the 1890s.,109,English,Brazil,"Thriller, Fantasy, Horror, Drama",Robert Pattinson (Thomas Howard),Willem Dafoe (Thomas Wake),Valeriia Karaman (Mermaid),Logan Hawkes (Ephraim Winslow),Kyla Nicolle (Woman on the Rocks),https://a.ltrbxd.com/resized/sm/upload/q3/nd/ae/zn/the-lighthouse-1200-1200-675-675-crop-000000.jpg?v=d3734cdd04,"RT Features, Parts & Labor, A24, Regency Enterprises"
https://boxd.it/2a88,Spider-Man 2,2004,Sam Raimi,3.92,"Peter Parker is going through a major identity crisis. Burned out from being Spider-Man, he decides to shelve his superhero alter ego, which leaves the city suffering in the wake of carnage left by the evil Doc Ock. In the meantime, Parker still can't act on his feelings for Mary Jane Watson, a girl he's loved since childhood. A certain anger begins to brew in his best friend Harry Osborn as well...",127,English,USA,"Action, Science Fiction, Adventure",Tobey Maguire (Spider-Man / Peter Parker),Kirsten Dunst (Mary Jane Watson),James Franco (Harry Osborn),Alfred Molina (Doc Ock / Otto Octavius),Rosemary Harris (May Parker),https://a.ltrbxd.com/resized/sm/upload/w2/of/wm/ou/jz6NCADCgj4dWU8RM81Xvrokey4-1200-1200-675-675-crop-000000.jpg?v=c9c668bc42,"Marvel Enterprises, Laura Ziskin Productions, Columbia Pictures"
https://boxd.it/h4cS,Joker,2019,Todd Phillips,3.84,"During the 1980s, a failed stand-up comedian is driven insane and turns to a life of crime and chaos in Gotham City while becoming an infamous psychopathic crime figure.",122,English,Canada,"Drama, Thriller, Crime",Joaquin Phoenix (Arthur Fleck),Robert De Niro (Murray Franklin),Zazie Beetz (Sophie Dumond),Frances Conroy (Penny Fleck),Brett Cullen (Thomas Wayne),https://a.ltrbxd.com/resized/sm/upload/fe/g8/y5/ai/joker-2019-1200-1200-675-675-crop-000000.jpg?v=4c4634e8d5,"Warner Bros. Pictures, Joint Effort, Village Roadshow Pictures, Bron Studios, DC Films"
