letterboxd_uri,title,year,director,average_rating,synopsis,runtime,language,country,genres,cast_1,cast_2,cast_3,cast_4,cast_5,poster_url,studio
https://boxd.it/ikXW,Jurassic World Dominion,2022,Colin Trevorrow,2.28,"Four years after Isla Nublar was destroyed, dinosaurs now live—and hunt—alongside humans all over the world. This fragile balance will reshape the future and determine, once and for all, whether human beings are to remain the apex predators on a planet they now share with history's most fearsome creatures.",147,English,USA,"Thriller, Science Fiction, Adventure",Chris Pratt (Owen Grady),Bryce Dallas Howard (Claire Dearing),Laura Dern (Ellie Sattler),Sam Neill (Alan Grant),Jeff Goldblum (Ian Malcolm),https://a.ltrbxd.com/resized/sm/upload/hs/6k/hd/z6/jurassic-world-dominion-1200-1200-675-675-crop-000000.jpg?v=8ed9a0c604,"Amblin Entertainment, Universal Pictures"
https://boxd.it/2azS,The Lost World: Jurassic Park,1997,Steven Spielberg,3.14,"Four years after Jurassic Park's genetically bred dinosaurs ran amok, multimillionaire John Hammond shocks chaos theorist Ian Malcolm by revealing that he has been breeding more beasties at a secret location. Malcolm, his paleontologist ladylove and a wildlife videographer join an expedition to document the lethal lizards' natural behavior in this action-packed thriller.",129,English,USA,"Science Fiction, Action, Adventure",Jeff Goldblum (Ian Malcolm),Julianne Moore (Sarah Harding),Pete Postlethwaite (Roland Tembo),Arliss Howard (Peter Ludlow),Richard Attenborough (John Hammond),https://a.ltrbxd.com/resized/sm/upload/a8/6m/va/pq/the-lost-world-jurassic-park-1200-1200-675-675-crop-000000.jpg?v=77dfd20401,"Universal Pictures, Amblin Entertainment"
https://boxd.it/2bde,War of the Worlds,2005,Steven Spielberg,3.35,"Ray Ferrier is a divorced dockworker and less-than-perfect father. Soon after his ex-wife and her new husband drop off his teenage son and young daughter for a rare weekend visit, a strange and powerful lightning storm touches down.",117,English,USA,"Science Fiction, Thriller, Adventure",Tom Cruise (Ray Ferrier),Dakota Fanning (Rachel Ferrier),Justin Chatwin (Robbie Ferrier),Miranda Otto (Mary-Ann),Tim Robbins (Harlan Ogilvy),https://a.ltrbxd.com/resized/sm/upload/3e/48/mx/ww/war-worlds-150-1200-1200-675-675-crop-000000.jpg?v=56bda2a3b3,"Paramount Pictures, DreamWorks Pictures, Amblin Entertainment, Cruise/Wagner Productions"
https://boxd.it/27Qm,Superman,1978,Richard Donner,3.72,"Mild-mannered Clark Kent works as a reporter at the Daily Planet alongside his crush, Lois Lane. Clark must summon his superhero alter-ego when the nefarious Lex Luthor launches a plan to take over the world.",144,English,UK,"Action, Adventure, Science Fiction",Christopher Reeve (Clark Kent / Superman),Margot Kidder (Lois Lane),Gene Hackman (Lex Luthor),Marlon Brando (Jor-El),Ned Beatty (Otis),https://a.ltrbxd.com/resized/sm/upload/tk/8z/fn/pl/superman-1200-1200-675-675-crop-000000.jpg?v=baa1ed8433,"Dovemead Films, Alexander and Ilya Salkind Productions, International Film Production"
https://boxd.it/2a54,Jaws 2,1978,Jeannot Szwarc,2.72,Police chief Brody must protect the citizens of Amity after a second monstrous shark begins terrorizing the waters.,117,English,USA,"Thriller, Horror",Roy Scheider (Police Chief Martin Brody),Lorraine Gary (Ellen Brody),Murray Hamilton (Mayor Larry Vaughn),Joseph Mascolo (Len Peterson),Jeffrey Kramer (Hendricks),https://a.ltrbxd.com/resized/sm/upload/se/3t/3q/14/jaws-2-1200-1200-675-675-crop-000000.jpg?v=202e2f13bc,"Universal Pictures, The Zanuck/Brown Company"
https://boxd.it/2aIg,Batman Begins,2005,Christopher Nolan,3.84,"Driven by tragedy, billionaire Bruce Wayne dedicates his life to uncovering and defeating the corruption that plagues his home, Gotham City. Unable to work within the system, he instead creates a new identity, a symbol of fear for the criminal underworld - The Batman.",140,English,UK,"Crime, Action, Drama",Christian Bale (Bruce Wayne / Batman),Michael Caine (Alfred),Liam Neeson (Ducard),Katie Holmes (Rachel Dawes),Gary Oldman (Jim Gordon),https://a.ltrbxd.com/resized/sm/upload/08/e5/aa/ws/batman-begins-30-1200-1200-675-675-crop-000000.jpg?v=2d07a1ac53,"Warner Bros. Pictures, DC, Syncopy, Legendary Pictures, Patalex III Productions Limited"
https://boxd.it/d0Y6,Dunkirk,2017,Christopher Nolan,3.77,"The story of the miraculous evacuation of Allied soldiers from Belgium, Britain, Canada and France, who were cut off and surrounded by the German army from the beaches and harbour of Dunkirk between May 26th and June 4th 1940 during World War II.",107,English,UK,"Action, Drama, War",Fionn Whitehead (Tommy),Tom Hardy (Farrier),Mark Rylance (Mr. Dawson),Kenneth Branagh (Commander Bolton),Cillian Murphy (Shivering Soldier),https://a.ltrbxd.com/resized/sm/upload/l9/2l/7p/rz/dunkirk-2017-1200-1200-675-675-crop-000000.jpg?v=53e6d125e1,"Warner Bros. Pictures, Syncopy, Dombey Street Productions"
https://boxd.it/H3m,The Dark Knight Rises,2012,Christopher Nolan,3.81,"Following the death of District Attorney Harvey Dent, Batman assumes responsibility for Dent's crimes to protect the late attorney's reputation and is subsequently hunted by the Gotham City Police Department. Eight years later, Batman encounters the mysterious Selina Kyle and the villainous Bane, a new terrorist leader who overwhelms Gotham's finest. The Dark Knight resurfaces to protect a city that has branded him an enemy.",165,English,UK,"Thriller, Crime, Drama, Action",Christian Bale (Bruce Wayne),Gary Oldman (Commissioner Gordon),Tom Hardy (Bane),Joseph Gordon-Levitt (Blake),Anne Hathaway (Selina),https://a.ltrbxd.com/resized/sm/upload/am/k2/f0/ij/dark-knight-rises-1200-1200-675-675-crop-000000.jpg?v=8b93dcd6f0,"Syncopy, Legendary Pictures, Warner Bros. Pictures, DC"
https://boxd.it/1Yws,Kung Fu Panda,2008,"Mark Osborne, John Stevenson",3.92,"Chosen by prophecy but doubted by all, Po is an unlikely choice for the mystical title of the Dragon Warrior—a clumsy panda thrust into the world of kung fu as a deadly enemy threatens the Valley of Peace. Under reluctant guidance by Master Shifu and the Furious Five, Po must embrace who he is to unlock the power that no scroll can teach.",90,English,USA,"Comedy, Family, Animation, Action",Jack Black (Po (voice)),Dustin Hoffman (Master Shifu (voice)),Angelina Jolie (Tigress (voice)),Ian McShane (Tai Lung (voice)),Seth Rogen (Mantis (voice)),https://a.ltrbxd.com/resized/sm/upload/q8/hk/5s/lu/kung-fu-panda-110-1200-1200-675-675-crop-000000.jpg?v=8d62e7df56,DreamWorks Animation
https://boxd.it/3utM,The Amazing Spider-Man 2,2014,Marc Webb,3.20,"For Peter Parker, life is busy. Between taking out the bad guys as Spider-Man and spending time with the person he loves, Gwen Stacy, high school graduation cannot come quickly enough. Peter has not forgotten about the promise he made to Gwen’s father to protect her by staying away, but that is a promise he cannot keep. Things will change for Peter when a new villain, Electro, emerges, an old friend, Harry Osborn, returns, and Peter uncovers new clues about his past.",141,English,USA,"Science Fiction, Action, Adventure",Andrew Garfield (Spider-Man / Peter Parker),Emma Stone (Gwen Stacy),Jamie Foxx (Electro / Max Dillon),Dane DeHaan (Green Goblin / Harry Osborn),Colm Feore (Donald Menken),https://a.ltrbxd.com/resized/sm/upload/8g/vh/5j/hp/the-amazing-spider-man-2-1200-1200-675-675-crop-000000.jpg?v=365c496a70,"Columbia Pictures, Matt Tolmach Productions, Arad Productions, Marvel Entertainment"
https://boxd.it/29dc,Madagascar,2005,"Eric Darnell, Tom McGrath",3.61,Four animal friends get a taste of the wild life when they break out of captivity at the Central Park Zoo and wash ashore on the island of Madagascar.,86,English,USA,"Family, Comedy, Animation, Adventure",Ben Stiller (Alex (voice)),Chris Rock (Marty (voice)),David Schwimmer (Melman (voice)),Jada Pinkett Smith (Gloria (voice)),Sacha Baron Cohen (King Julien (voice)),https://a.ltrbxd.com/resized/sm/upload/5s/9u/c1/pv/madagascar-1200-1200-675-675-crop-000000.jpg?v=ab79d7685c,"Pacific Data Images, DreamWorks Animation"
https://boxd.it/16Sk,Megamind,2010,Tom McGrath,3.76,"After Megamind, a highly intelligent alien supervillain, defeats his long-time nemesis Metro Man, Megamind creates a new hero to fight, but must act to save the city when his ""creation"" becomes an even worse villain than he was.",96,English,USA,"Comedy, Science Fiction, Action, Family, Animation",Will Ferrell (Megamind (voice)),Brad Pitt (Metro Man (voice)),Tina Fey (Roxanne Ritchi (voice)),Jonah Hill (Tighten (voice)),David Cross (Minion (voice)),https://a.ltrbxd.com/resized/sm/upload/mg/7i/be/rb/megamind-150-1200-1200-675-675-crop-000000.jpg?v=aa8c827f40,"DreamWorks Animation, Pacific Data Images"
https://boxd.it/2aGu,Pirates of the Caribbean: At World's End,2007,Gore Verbinski,3.61,"After losing Captain Jack Sparrow to the locker of Davy Jones, Will Turner, Elizabeth Swann, and Captain Barbossa journey to the ends of the earth to rescue him. And as the East India Trading Company tightens its grip on the seas under Lord Cutler Beckett—now in control of Davy Jones—the fate of piracy hangs by a thread. Now, they must unite the pirate lords for one final stand. But as loyalties are tested and alliances shift, each must ultimately choose where they stand in the battle for freedom on the high seas.",169,English,USA,"Adventure, Action, Fantasy",Johnny Depp (Jack Sparrow),Geoffrey Rush (Barbossa),Orlando Bloom (Will Turner),Keira Knightley (Elizabeth Swann),Jack Davenport (Norrington),https://a.ltrbxd.com/resized/sm/upload/er/ay/4v/hh/pirates-at-worlds-end-80-1200-1200-675-675-crop-000000.jpg?v=20ddbd6d9f,"Jerry Bruckheimer Films, Second Mate Productions, Walt Disney Pictures"
https://boxd.it/FRk,Man of Steel,2013,Zack Snyder,3.05,"A young boy learns that he has extraordinary powers and is not of this earth. As a young man, he journeys to discover where he came from and what he was sent here to do. But the hero in him must emerge if he is to save the world from annihilation and become the symbol of hope for all mankind.",143,English,UK,"Action, Adventure, Science Fiction",Henry Cavill (Clark Kent / Superman / Kal-El),Amy Adams (Lois Lane),Russell Crowe (Jor-El),Michael Shannon (General Zod),Kevin Costner (Jonathan Kent),https://a.ltrbxd.com/resized/sm/upload/ca/j6/xk/6f/man-of-steel-1200-1200-675-675-crop-000000.jpg?v=28e9a32f62,"Syncopy, Peters Entertainment, Warner Bros. Pictures, DC"
https://boxd.it/6fBW,Batman v Superman: Dawn of Justice,2016,Zack Snyder,2.47,"Fearing the actions of a god-like Super Hero left unchecked, Gotham City’s own formidable, forceful vigilante takes on Metropolis’s most revered, modern-day savior, while the world wrestles with what sort of hero it really needs. And with Batman and Superman at war with one another, a new threat quickly arises, putting mankind in greater danger than it’s ever known before.",152,English,USA,"Action, Fantasy, Adventure",Ben Affleck (Bruce Wayne / Batman),Henry Cavill (Clark Kent / Superman),Jesse Eisenberg (Lex Luthor),Gal Gadot (Diana Prince / Wonder Woman),Amy Adams (Lois),https://a.ltrbxd.com/resized/sm/upload/ua/mn/pb/t9/batman-v-superman-dawn-of-justice-1200-1200-675-675-crop-000000.jpg?v=83114a32b5,"Warner Bros. Pictures, RatPac Entertainment, Atlas Entertainment, Cruel & Unusual Films, DC"
https://boxd.it/G36,Kung Fu Panda 2,2011,Jennifer Yuh Nelson,3.77,"Po is finally living the dream as the Dragon Warrior—until a shadow from his past comes roaring back. When the ruthless peacock Lord Shen unleashes a devastating new weapon used to wipe out kung fu masters across the land, Po and the Furious Five race across China to put an end to his plans. But if Po is to have any hope of stopping him, he must first confront the truth of his origins—and find inner peace before his past tears him apart.",91,English,USA,"Family, Action, Animation, Comedy",Jack Black (Po (voice)),Angelina Jolie (Tigress (voice)),Dustin Hoffman (Master Shifu (voice)),Gary Oldman (Lord Shen (voice)),Jackie Chan (Monkey (voice)),https://a.ltrbxd.com/resized/sm/upload/9a/wr/9r/8f/kung-fu-panda-2-50-1200-1200-675-675-crop-000000.jpg?v=bc1be2dc26,DreamWorks Animation
https://boxd.it/27Z4,Pirates of the Caribbean: On Stranger Tides,2011,Rob Marshall,2.96,"When Jack crosses paths with a woman from his past, he's not sure if it's love...or if she's a ruthless con artist using him to find the fabled Fountain of Youth.",136,English,UK,"Adventure, Fantasy, Action",Johnny Depp (Jack Sparrow),Penélope Cruz (Angelica),Geoffrey Rush (Hector Barbossa),"Ian McShane (Edward ""Blackbeard"" Teach)",Kevin McNally (Joshamee Gibbs),https://a.ltrbxd.com/resized/sm/upload/0y/yj/79/0k/pirates-on-stranger-tides-40-1200-1200-675-675-crop-000000.jpg?v=b839f295f0,"Walt Disney Pictures, Jerry Bruckheimer Films, Moving Picture Company"
https://boxd.it/1W2A,Sherlock Holmes,2009,Guy Ritchie,3.49,Eccentric consulting detective Sherlock Holmes and Doctor John Watson battle to bring down a new nemesis and unravel a deadly plot that could destroy England.,129,English,USA,"Mystery, Adventure, Crime",Robert Downey Jr. (Sherlock Holmes),Jude Law (Dr. John Watson),Rachel McAdams (Irene Adler),Mark Strong (Lord Henry Blackwood),Eddie Marsan (Inspector Lestrade),https://a.ltrbxd.com/resized/sm/upload/u9/e3/2j/24/sherlock-holmes-80-1200-1200-675-675-crop-000000.jpg?v=e70b4ff396,"Warner Bros. Pictures, Village Roadshow Pictures, Silver Pictures, Wigram Productions"
https://boxd.it/eSjI,The Lion King,2019,Jon Favreau,2.89,"Simba idolizes his father, King Mufasa, and takes to heart his own royal destiny. But not everyone in the kingdom celebrates the new cub's arrival. Scar, Mufasa's brother—and former heir to the throne—has plans of his own. The battle for Pride Rock is ravaged with betrayal, tragedy and drama, ultimately resulting in Simba's exile. With help from a curious pair of newfound friends, Simba will have to figure out how to grow up and take back what is rightfully his.",118,English,USA,"Family, Adventure, Drama, Animation",Chiwetel Ejiofor (Scar (voice)),John Oliver (Zazu (voice)),Donald Glover (Simba (voice)),James Earl Jones (Mufasa (voice)),John Kani (Rafiki (voice)),https://a.ltrbxd.com/resized/sm/upload/57/7g/9e/v0/the-lion-king-2019-1200-1200-675-675-crop-000000.jpg?v=241a0f0bfe,"Walt Disney Pictures, Fairview Entertainment"
https://boxd.it/1VYe,Shark Tale,2004,"Bibo Bergeron, Rob Letterman et al",3.04,"Oscar is a small fish whose big aspirations often get him into trouble. Meanwhile, Lenny is a great white shark with a surprising secret that no sea creature would guess: He's a vegetarian. When a lie turns Oscar into an improbable hero and Lenny becomes an outcast, the two form an unlikely friendship.",90,English,USA,"Animation, Action, Comedy, Family",Will Smith (Oscar (voice)),Robert De Niro (Don Lino (voice)),Renée Zellweger (Angie (voice)),Jack Black (Lenny (voice)),Angelina Jolie (Lola (voice)),https://a.ltrbxd.com/resized/sm/upload/es/jj/xa/dh/shark-tale-1200-1200-675-675-crop-000000.jpg?v=bf3494a679,DreamWorks Animation
https://boxd.it/CepE,Kung Fu Panda 4,2024,Mike Mitchell,2.65,"Po is gearing up to become the spiritual leader of his Valley of Peace, but also needs someone to take his place as Dragon Warrior. As such, he will train a new kung fu practitioner for the spot and will encounter a villain called the Chameleon who conjures villains from the past.",94,English,USA,"Adventure, Comedy, Fantasy, Family, Animation, Action",Jack Black (Po (voice)),Awkwafina (Zhen (voice)),Viola Davis (The Chameleon (voice)),Dustin Hoffman (Shifu (voice)),Bryan Cranston (Li (voice)),https://a.ltrbxd.com/resized/sm/upload/sh/gd/63/3u/kung%20fu-1200-1200-675-675-crop-000000.jpg?v=bfcec56c23,DreamWorks Animation
https://boxd.it/4uRQ,Kung Fu Panda 3,2016,"Jennifer Yuh Nelson, Alessandro Carloni",3.30,"While Po and his father are visiting a secret panda village, an evil spirit threatens all of China, forcing Po to form a ragtag army to fight back.",95,English,China,"Adventure, Comedy, Action, Family, Animation",Jack Black (Po (voice)),Bryan Cranston (Li (voice)),Dustin Hoffman (Shifu (voice)),Angelina Jolie (Tigress (voice)),J.K. Simmons (Kai (voice)),https://a.ltrbxd.com/resized/sm/upload/2f/24/zk/76/kung-fu-panda-3-1200-1200-675-675-crop-000000.jpg?v=dd4af7666e,"DreamWorks Animation, Oriental DreamWorks, Zhong Ming You Ying Film, China Film Group Corporation 中国电影集团 (CFGC)"
https://boxd.it/1W2K,Madagascar: Escape 2 Africa,2008,"Eric Darnell, Tom McGrath",3.27,"Alex, Marty, and other zoo animals find a way to escape from Madagascar when the penguins reassemble a wrecked airplane. The precariously repaired craft stays airborne just long enough to make it to the African continent. There the New Yorkers encounter members of their own species for the first time. Africa proves to be a wild place, but Alex and company wonder if it is better than their Central Park home.",89,English,USA,"Animation, Family, Comedy, Adventure",Ben Stiller (Alex (voice)),Chris Rock (Marty / Additional Zebras (voice)),David Schwimmer (Melman (voice)),Jada Pinkett Smith (Gloria (voice)),Sacha Baron Cohen (Julien (voice)),https://a.ltrbxd.com/resized/sm/upload/g4/l1/jr/54/madagascar-2-1200-1200-675-675-crop-000000.jpg?v=6ac6c7a43f,"DreamWorks Animation, Pacific Data Images"
https://boxd.it/anyO,Dark Phoenix,2019,Simon Kinberg,2.10,"The X-Men face their most formidable and powerful foe when one of their own, Jean Grey, starts to spiral out of control. During a rescue mission in outer space, Jean is nearly killed when she's hit by a mysterious cosmic force. Once she returns home, this force not only makes her infinitely more powerful, but far more unstable. The X-Men must now band together to save her soul and battle aliens that want to use Grey's new abilities to rule the galaxy.",114,English,USA,"Science Fiction, Action, Adventure",Sophie Turner (Jean Grey / Dark Phoenix),James McAvoy (Charles Xavier / Professor X),Nicholas Hoult (Hank McCoy / Beast),Tye Sheridan (Scott Summers / Cyclops),Michael Fassbender (Erik Lensherr / Magneto),https://a.ltrbxd.com/resized/sm/upload/28/td/16/84/dark-phoenix-1200-1200-675-675-crop-000000.jpg?v=6287a2c731,"Genre Films, Hutch Parker Entertainment, 20th Century Fox, TSG Entertainment, Marvel Entertainment"
https://boxd.it/2NF6,Madagascar 3: Europe's Most Wanted,2012,"Eric Darnell, Tom McGrath et al",3.14,"Animal pals Alex, Marty, Melman, and Gloria are still trying to make it back to New York's Central Park Zoo. They are forced to take a detour to Europe to find the penguins and chimps who broke the bank at a Monte Carlo casino. When French animal-control officer Capitaine Chantel DuBois picks up their scent, Alex and company are forced to hide out in a traveling circus.",93,English,USA,"Comedy, Family, Adventure, Animation",Ben Stiller (Alex (voice)),Chris Rock (Marty (voice)),David Schwimmer (Melman (voice)),Jada Pinkett Smith (Gloria (voice)),Frances McDormand (Captain Chantel DuBois (voice)),https://a.ltrbxd.com/resized/sm/upload/om/8z/fg/zp/madagascar-3-europes-most-wanted-1200-1200-675-675-crop-000000.jpg?v=c072ac9d17,"DreamWorks Animation, Pacific Data Images"
https://boxd.it/k3S,Sherlock Holmes: A Game of Shadows,2011,Guy Ritchie,3.37,"There is a new criminal mastermind at large (Professor Moriarty) and not only is he Holmes’ intellectual equal, but his capacity for evil and lack of conscience may give him an advantage over the detective.",129,English,USA,"Mystery, Adventure, Crime",Robert Downey Jr. (Sherlock Holmes),Jude Law (Dr. John Watson),Noomi Rapace (Madam Simza Heron),Jared Harris (Professor James Moriarty),Rachel McAdams (Irene Adler),https://a.ltrbxd.com/resized/sm/upload/v3/g3/ly/ql/sherlock-holmes-a-game-of-shadows-1200-1200-675-675-crop-000000.jpg?v=7e09cba280,"Village Roadshow Pictures, Silver Pictures, Wigram Productions, Lin Pictures"
https://boxd.it/9mfO,The Boss Baby,2017,Tom McGrath,2.62,"A story about how a new baby's arrival impacts a family, told from the point of view of a delightfully unreliable narrator, a wildly imaginative 7 year old named Tim.",97,English,USA,"Animation, Comedy, Family",Alec Baldwin (Theodore Templeton (voice)),Steve Buscemi (Francis E. Francis (voice)),Miles Bakshi (Tim Templeton (voice)),Jimmy Kimmel (Ted Templeton (voice)),Lisa Kudrow (Janice Templeton (voice)),https://a.ltrbxd.com/resized/sm/upload/yt/4e/ok/tw/the-boss-baby-1200-1200-675-675-crop-000000.jpg?v=169e5f6c79,DreamWorks Animation
https://boxd.it/29rI,Black Hawk Down,2001,Ridley Scott,3.70,"When U.S. Rangers and an elite Delta Force team attempt to kidnap two underlings of a Somali warlord, their Black Hawk helicopters are shot down, and the Americans suffer heavy casualties, facing intense fighting from the militia on the ground.",145,English,UK,"Action, History, War",Josh Hartnett (SSG Matthew Eversmann),Eric Bana (SFC Norm 'Hoot' Gibson),Ewan McGregor (SPC John Grimes),Tom Sizemore (LTC Danny McKnight),William Fichtner (SFC Jeff Sanderson),https://a.ltrbxd.com/resized/sm/upload/sw/s8/22/rk/black-hawk-down-1200-1200-675-675-crop-000000.jpg?v=68b2b48bbd,"Jerry Bruckheimer Films, Revolution Studios, Scott Free Productions"
https://boxd.it/9SlO,War Dogs,2016,Todd Phillips,3.50,"Based on the true story of two young men, David Packouz and Efraim Diveroli, who won a $300 million contract from the Pentagon to arm America's allies in Afghanistan.",114,English,USA,"Drama, Comedy, Crime",Miles Teller (David Packouz),Jonah Hill (Efraim Diveroli),Ana de Armas (Iz),Bradley Cooper (Henry Girard),Kevin Pollak (Ralph Slutzky),https://a.ltrbxd.com/resized/sm/upload/hc/89/bn/2e/war-dogs-1200-1200-675-675-crop-000000.jpg?v=82be333b95,"The Mark Gordon Company, Joint Effort, RatPac Entertainment, Warner Bros. Pictures"
https://boxd.it/7dEc,John Wick,2014,Chad Stahelski,3.84,Ex-hitman John Wick comes out of retirement to track down the gangsters that took everything from him.,101,English,USA,"Action, Thriller",Keanu Reeves (John Wick),Michael Nyqvist (Viggo Tarasov),Alfie Allen (Iosef Tarasov),Willem Dafoe (Marcus),Dean Winters (Avi),https://a.ltrbxd.com/resized/sm/upload/wp/bs/m0/17/john-wick-1200-1200-675-675-crop-000000.jpg?v=a0df875fb4,"87Eleven, DefyNite Films, MJW Films, Thunder Road"
https://boxd.it/mh48,John Wick: Chapter 4,2023,Chad Stahelski,3.89,"With the price on his head ever increasing, John Wick uncovers a path to defeating The High Table. But before he can earn his freedom, Wick must face off against a new enemy with powerful alliances across the globe and forces that turn old friends into foes.",170,English,Germany,"Crime, Action, Thriller",Keanu Reeves (John Wick),Donnie Yen (Caine),Bill Skarsgård (Marquis),Ian McShane (Winston),Laurence Fishburne (Bowery King),https://a.ltrbxd.com/resized/sm/upload/o8/dp/yo/aa/john-wick-chapter-4-1200-1200-675-675-crop-000000.jpg?v=2e60eff48c,"Thunder Road, 87Eleven, Studio Babelsberg, Lionsgate"
https://boxd.it/ayGu,John Wick: Chapter 2,2017,Chad Stahelski,3.71,"John Wick is forced out of retirement by a former associate looking to seize control of a shadowy international assassins’ guild. Bound by a blood oath to aid him, Wick travels to Rome and does battle against some of the world’s most dangerous killers.",122,English,USA,"Crime, Action, Thriller",Keanu Reeves (John Wick),Common (Cassian),Laurence Fishburne (Bowery King),Riccardo Scamarcio (Santino D'Antonio),Ruby Rose (Ares),https://a.ltrbxd.com/resized/sm/upload/de/gu/a5/e4/john-wick-2-1200-1200-675-675-crop-000000.jpg?v=033ad850c4,"Thunder Road, 87Eleven, Summit Entertainment"
https://boxd.it/gmFw,John Wick: Chapter 3 – Parabellum,2019,Chad Stahelski,3.69,"Super-assassin John Wick returns with a $14 million price tag on his head and an army of bounty-hunting killers on his trail. After killing a member of the shadowy international assassin’s guild, the High Table, John Wick is excommunicado, but the world’s most ruthless hit men and women await his every turn.",131,English,USA,"Action, Crime, Thriller",Keanu Reeves (John Wick),Halle Berry (Sofia),Ian McShane (Winston),Laurence Fishburne (Bowery King),Mark Dacascos (Zero),https://a.ltrbxd.com/resized/sm/upload/o8/57/vf/l3/john-wick-3-parabellum-1200-1200-675-675-crop-000000.jpg?v=0643690c1f,"Thunder Road, Lionsgate, 87Eleven"
https://boxd.it/1ZHQ,How the Grinch Stole Christmas,2000,Ron Howard,3.60,The Grinch decides to rob Whoville of Christmas - but a dash of kindness from little Cindy Lou Who and her family may be enough to melt his heart...,105,English,USA,"Comedy, Family, Fantasy",Jim Carrey (Grinch),Taylor Momsen (Cindy Lou Who),Jeffrey Tambor (Mayor Augustus Maywho),Christine Baranski (Martha May Whovier),Bill Irwin (Lou Lou Who),https://a.ltrbxd.com/resized/sm/upload/6h/i1/t2/uw/how-the-grinch-stole-christmas-1200-1200-675-675-crop-000000.jpg?v=51d0d7e708,"Universal Pictures, Imagine Entertainment, LUNI Productions"
https://boxd.it/29rS,The Mask,1994,Chuck Russell,3.42,"Stanley Ipkiss, an insecure banker who has lost his zest for life stumbles upon an ancient mask, that turns him into a confident suave cartoon-like character who upsets his ordinary life.",101,English,USA,"Fantasy, Romance, Crime, Comedy",Jim Carrey (Stanley Ipkiss / The Mask),Peter Riegert (Mitch Kellaway),Peter Greene (Dorian Tyrrell),Amy Yasbeck (Peggy Brandt),Richard Jeni (Charlie Schumaker),https://a.ltrbxd.com/resized/sm/upload/22/02/m2/oa/the-mask-1200-1200-675-675-crop-000000.jpg?v=19b69a05f4,"Dark Horse Entertainment, New Line Cinema"
